[I 2026-03-22 08:00:10,260] Trial 122 finished with value: 39.94426133787869 and parameters: {'hidden_size': 64, 'n_heads': 4, 'encoder_layers': 4, 'linear_hidden_size': 512, 'patch_len': 16, 'stride': 8, 'dropout': 0.1, 'fc_dropout': 0.2, 'attn_dropout': 0.1, 'revin': True, 'input_size': 96, 'learning_rate': 0.00197472487889238, 'scaler_type': 'identity', 'model_step_size': 1}. Best is trial 122 with value: 39.94426133787869.
Seed set to 1
GPU available: True (cuda), used: True
TPU available: False, using: 0 TPU cores
HPU available: False, using: 0 HPUs
LOCAL_RANK: 0 - CUDA_VISIBLE_DEVICES: [0]

  | Name         | Type              | Params | Mode
-----------------------------------------------------------
0 | loss         | MSE               | 0      | train
1 | valid_loss   | MSE               | 0      | train
2 | padder_train | ConstantPad1d     | 0      | train
3 | scaler       | TemporalNorm      | 0      | train
4 | model        | PatchTST_backbone | 340 K  | train
-----------------------------------------------------------
340 K     Trainable params
4         Non-trainable params
340 K     Total params
1.360     Total estimated model params size (MB)
116       Modules in train mode
0         Modules in eval mode
`Trainer.fit` stopped: `max_steps=1000` reached.
Trainer already configured with model summary callbacks: [<class 'pytorch_lightning.callbacks.model_summary.ModelSummary'>]. Skipping setting a default `ModelSummary` callback.
GPU available: True (cuda), used: True
TPU available: False, using: 0 TPU cores
HPU available: False, using: 0 HPUs
LOCAL_RANK: 0 - CUDA_VISIBLE_DEVICES: [0]
Seed set to 1
GPU available: True (cuda), used: True
TPU available: False, using: 0 TPU cores
HPU available: False, using: 0 HPUs
LOCAL_RANK: 0 - CUDA_VISIBLE_DEVICES: [0]

  | Name         | Type              | Params | Mode
-----------------------------------------------------------
0 | loss         | MSE               | 0      | train
1 | valid_loss   | MSE               | 0      | train
2 | padder_train | ConstantPad1d     | 0      | train
3 | scaler       | TemporalNorm      | 0      | train
4 | model        | PatchTST_backbone | 340 K  | train
-----------------------------------------------------------
340 K     Trainable params
4         Non-trainable params
340 K     Total params
1.360     Total estimated model params size (MB)
116       Modules in train mode
0         Modules in eval mode
`Trainer.fit` stopped: `max_steps=1000` reached.
Trainer already configured with model summary callbacks: [<class 'pytorch_lightning.callbacks.model_summary.ModelSummary'>]. Skipping setting a default `ModelSummary` callback.
GPU available: True (cuda), used: True
TPU available: False, using: 0 TPU cores
HPU available: False, using: 0 HPUs
LOCAL_RANK: 0 - CUDA_VISIBLE_DEVICES: [0]
Seed set to 1
GPU available: True (cuda), used: True
TPU available: False, using: 0 TPU cores
HPU available: False, using: 0 HPUs
LOCAL_RANK: 0 - CUDA_VISIBLE_DEVICES: [0]

  | Name         | Type              | Params | Mode
-----------------------------------------------------------
0 | loss         | MSE               | 0      | train
1 | valid_loss   | MSE               | 0      | train
2 | padder_train | ConstantPad1d     | 0      | train
3 | scaler       | TemporalNorm      | 0      | train
4 | model        | PatchTST_backbone | 340 K  | train
-----------------------------------------------------------
340 K     Trainable params
4         Non-trainable params
340 K     Total params
1.360     Total estimated model params size (MB)
116       Modules in train mode
0         Modules in eval mode
`Trainer.fit` stopped: `max_steps=1000` reached.
Trainer already configured with model summary callbacks: [<class 'pytorch_lightning.callbacks.model_summary.ModelSummary'>]. Skipping setting a default `ModelSummary` callback.
GPU available: True (cuda), used: True
TPU available: False, using: 0 TPU cores
HPU available: False, using: 0 HPUs
LOCAL_RANK: 0 - CUDA_VISIBLE_DEVICES: [0]
Seed set to 1
GPU available: True (cuda), used: True
TPU available: False, using: 0 TPU cores
HPU available: False, using: 0 HPUs
LOCAL_RANK: 0 - CUDA_VISIBLE_DEVICES: [0]

  | Name         | Type              | Params | Mode
-----------------------------------------------------------
0 | loss         | MSE               | 0      | train
1 | valid_loss   | MSE               | 0      | train
2 | padder_train | ConstantPad1d     | 0      | train
3 | scaler       | TemporalNorm      | 0      | train
4 | model        | PatchTST_backbone | 340 K  | train
-----------------------------------------------------------
340 K     Trainable params
4         Non-trainable params
340 K     Total params
1.360     Total estimated model params size (MB)
116       Modules in train mode
0         Modules in eval mode
`Trainer.fit` stopped: `max_steps=1000` reached.
Trainer already configured with model summary callbacks: [<class 'pytorch_lightning.callbacks.model_summary.ModelSummary'>]. Skipping setting a default `ModelSummary` callback.
GPU available: True (cuda), used: True
TPU available: False, using: 0 TPU cores
HPU available: False, using: 0 HPUs
LOCAL_RANK: 0 - CUDA_VISIBLE_DEVICES: [0]
Seed set to 1
GPU available: True (cuda), used: True
TPU available: False, using: 0 TPU cores
HPU available: False, using: 0 HPUs
LOCAL_RANK: 0 - CUDA_VISIBLE_DEVICES: [0]

  | Name         | Type              | Params | Mode
-----------------------------------------------------------
0 | loss         | MSE               | 0      | train
1 | valid_loss   | MSE               | 0      | train
2 | padder_train | ConstantPad1d     | 0      | train
3 | scaler       | TemporalNorm      | 0      | train
4 | model        | PatchTST_backbone | 340 K  | train
-----------------------------------------------------------
340 K     Trainable params
4         Non-trainable params
340 K     Total params
1.360     Total estimated model params size (MB)
116       Modules in train mode
0         Modules in eval mode
`Trainer.fit` stopped: `max_steps=1000` reached.
Trainer already configured with model summary callbacks: [<class 'pytorch_lightning.callbacks.model_summary.ModelSummary'>]. Skipping setting a default `ModelSummary` callback.
GPU available: True (cuda), used: True
TPU available: False, using: 0 TPU cores
HPU available: False, using: 0 HPUs
LOCAL_RANK: 0 - CUDA_VISIBLE_DEVICES: [0]
[I 2026-03-22 08:02:37,186] Trial 123 finished with value: 40.722791034665065 and parameters: {'hidden_size': 64, 'n_heads': 4, 'encoder_layers': 4, 'linear_hidden_size': 512, 'patch_len': 16, 'stride': 8, 'dropout': 0.1, 'fc_dropout': 0.2, 'attn_dropout': 0.1, 'revin': True, 'input_size': 96, 'learning_rate': 0.0019681809227009117, 'scaler_type': 'identity', 'model_step_size': 1}. Best is trial 122 with value: 39.94426133787869.
Seed set to 1
GPU available: True (cuda), used: True
TPU available: False, using: 0 TPU cores
HPU available: False, using: 0 HPUs
LOCAL_RANK: 0 - CUDA_VISIBLE_DEVICES: [0]

  | Name         | Type              | Params | Mode
-----------------------------------------------------------
0 | loss         | MSE               | 0      | train
1 | valid_loss   | MSE               | 0      | train
2 | padder_train | ConstantPad1d     | 0      | train
3 | scaler       | TemporalNorm      | 0      | train
4 | model        | PatchTST_backbone | 340 K  | train
-----------------------------------------------------------
340 K     Trainable params
4         Non-trainable params
340 K     Total params
1.360     Total estimated model params size (MB)
116       Modules in train mode
0         Modules in eval mode
`Trainer.fit` stopped: `max_steps=1000` reached.
Trainer already configured with model summary callbacks: [<class 'pytorch_lightning.callbacks.model_summary.ModelSummary'>]. Skipping setting a default `ModelSummary` callback.
GPU available: True (cuda), used: True
TPU available: False, using: 0 TPU cores
HPU available: False, using: 0 HPUs
LOCAL_RANK: 0 - CUDA_VISIBLE_DEVICES: [0]
Seed set to 1
GPU available: True (cuda), used: True
TPU available: False, using: 0 TPU cores
HPU available: False, using: 0 HPUs
LOCAL_RANK: 0 - CUDA_VISIBLE_DEVICES: [0]

  | Name         | Type              | Params | Mode
-----------------------------------------------------------
0 | loss         | MSE               | 0      | train
1 | valid_loss   | MSE               | 0      | train
2 | padder_train | ConstantPad1d     | 0      | train
3 | scaler       | TemporalNorm      | 0      | train
4 | model        | PatchTST_backbone | 340 K  | train
-----------------------------------------------------------
340 K     Trainable params
4         Non-trainable params
340 K     Total params
1.360     Total estimated model params size (MB)
116       Modules in train mode
0         Modules in eval mode
`Trainer.fit` stopped: `max_steps=1000` reached.
Trainer already configured with model summary callbacks: [<class 'pytorch_lightning.callbacks.model_summary.ModelSummary'>]. Skipping setting a default `ModelSummary` callback.
GPU available: True (cuda), used: True
TPU available: False, using: 0 TPU cores
HPU available: False, using: 0 HPUs
LOCAL_RANK: 0 - CUDA_VISIBLE_DEVICES: [0]
Seed set to 1
GPU available: True (cuda), used: True
TPU available: False, using: 0 TPU cores
HPU available: False, using: 0 HPUs
LOCAL_RANK: 0 - CUDA_VISIBLE_DEVICES: [0]

  | Name         | Type              | Params | Mode
-----------------------------------------------------------
0 | loss         | MSE               | 0      | train
1 | valid_loss   | MSE               | 0      | train
2 | padder_train | ConstantPad1d     | 0      | train
3 | scaler       | TemporalNorm      | 0      | train
4 | model        | PatchTST_backbone | 340 K  | train
-----------------------------------------------------------
340 K     Trainable params
4         Non-trainable params
340 K     Total params
1.360     Total estimated model params size (MB)
116       Modules in train mode
0         Modules in eval mode
`Trainer.fit` stopped: `max_steps=1000` reached.
Trainer already configured with model summary callbacks: [<class 'pytorch_lightning.callbacks.model_summary.ModelSummary'>]. Skipping setting a default `ModelSummary` callback.
GPU available: True (cuda), used: True
TPU available: False, using: 0 TPU cores
HPU available: False, using: 0 HPUs
LOCAL_RANK: 0 - CUDA_VISIBLE_DEVICES: [0]
Seed set to 1
GPU available: True (cuda), used: True
TPU available: False, using: 0 TPU cores
HPU available: False, using: 0 HPUs
LOCAL_RANK: 0 - CUDA_VISIBLE_DEVICES: [0]

  | Name         | Type              | Params | Mode
-----------------------------------------------------------
0 | loss         | MSE               | 0      | train
1 | valid_loss   | MSE               | 0      | train
2 | padder_train | ConstantPad1d     | 0      | train
3 | scaler       | TemporalNorm      | 0      | train
4 | model        | PatchTST_backbone | 340 K  | train
-----------------------------------------------------------
340 K     Trainable params
4         Non-trainable params
340 K     Total params
1.360     Total estimated model params size (MB)
116       Modules in train mode
0         Modules in eval mode
`Trainer.fit` stopped: `max_steps=1000` reached.
Trainer already configured with model summary callbacks: [<class 'pytorch_lightning.callbacks.model_summary.ModelSummary'>]. Skipping setting a default `ModelSummary` callback.
GPU available: True (cuda), used: True
TPU available: False, using: 0 TPU cores
HPU available: False, using: 0 HPUs
LOCAL_RANK: 0 - CUDA_VISIBLE_DEVICES: [0]
Seed set to 1
GPU available: True (cuda), used: True
TPU available: False, using: 0 TPU cores
HPU available: False, using: 0 HPUs
LOCAL_RANK: 0 - CUDA_VISIBLE_DEVICES: [0]

  | Name         | Type              | Params | Mode
-----------------------------------------------------------
0 | loss         | MSE               | 0      | train
1 | valid_loss   | MSE               | 0      | train
2 | padder_train | ConstantPad1d     | 0      | train
3 | scaler       | TemporalNorm      | 0      | train
4 | model        | PatchTST_backbone | 340 K  | train
-----------------------------------------------------------
340 K     Trainable params
4         Non-trainable params
340 K     Total params
1.360     Total estimated model params size (MB)
116       Modules in train mode
0         Modules in eval mode
`Trainer.fit` stopped: `max_steps=1000` reached.
Trainer already configured with model summary callbacks: [<class 'pytorch_lightning.callbacks.model_summary.ModelSummary'>]. Skipping setting a default `ModelSummary` callback.
GPU available: True (cuda), used: True
TPU available: False, using: 0 TPU cores
HPU available: False, using: 0 HPUs
LOCAL_RANK: 0 - CUDA_VISIBLE_DEVICES: [0]
[I 2026-03-22 08:05:04,845] Trial 124 finished with value: 39.612551678246675 and parameters: {'hidden_size': 64, 'n_heads': 4, 'encoder_layers': 4, 'linear_hidden_size': 512, 'patch_len': 16, 'stride': 8, 'dropout': 0.1, 'fc_dropout': 0.2, 'attn_dropout': 0.1, 'revin': True, 'input_size': 96, 'learning_rate': 0.0020018086402367984, 'scaler_type': 'identity', 'model_step_size': 1}. Best is trial 124 with value: 39.612551678246675.
Seed set to 1
GPU available: True (cuda), used: True
TPU available: False, using: 0 TPU cores
HPU available: False, using: 0 HPUs
LOCAL_RANK: 0 - CUDA_VISIBLE_DEVICES: [0]

  | Name         | Type              | Params | Mode
-----------------------------------------------------------
0 | loss         | MSE               | 0      | train
1 | valid_loss   | MSE               | 0      | train
2 | padder_train | ConstantPad1d     | 0      | train
3 | scaler       | TemporalNorm      | 0      | train
4 | model        | PatchTST_backbone | 339 K  | train
-----------------------------------------------------------
339 K     Trainable params
4         Non-trainable params
339 K     Total params
1.359     Total estimated model params size (MB)
116       Modules in train mode
0         Modules in eval mode
`Trainer.fit` stopped: `max_steps=1000` reached.
Trainer already configured with model summary callbacks: [<class 'pytorch_lightning.callbacks.model_summary.ModelSummary'>]. Skipping setting a default `ModelSummary` callback.
GPU available: True (cuda), used: True
TPU available: False, using: 0 TPU cores
HPU available: False, using: 0 HPUs
LOCAL_RANK: 0 - CUDA_VISIBLE_DEVICES: [0]
Seed set to 1
GPU available: True (cuda), used: True
TPU available: False, using: 0 TPU cores
HPU available: False, using: 0 HPUs
LOCAL_RANK: 0 - CUDA_VISIBLE_DEVICES: [0]

  | Name         | Type              | Params | Mode
-----------------------------------------------------------
0 | loss         | MSE               | 0      | train
1 | valid_loss   | MSE               | 0      | train
2 | padder_train | ConstantPad1d     | 0      | train
3 | scaler       | TemporalNorm      | 0      | train
4 | model        | PatchTST_backbone | 339 K  | train
-----------------------------------------------------------
339 K     Trainable params
4         Non-trainable params
339 K     Total params
1.359     Total estimated model params size (MB)
116       Modules in train mode
0         Modules in eval mode
`Trainer.fit` stopped: `max_steps=1000` reached.
Trainer already configured with model summary callbacks: [<class 'pytorch_lightning.callbacks.model_summary.ModelSummary'>]. Skipping setting a default `ModelSummary` callback.
GPU available: True (cuda), used: True
TPU available: False, using: 0 TPU cores
HPU available: False, using: 0 HPUs
LOCAL_RANK: 0 - CUDA_VISIBLE_DEVICES: [0]
Seed set to 1
GPU available: True (cuda), used: True
TPU available: False, using: 0 TPU cores
HPU available: False, using: 0 HPUs
LOCAL_RANK: 0 - CUDA_VISIBLE_DEVICES: [0]

  | Name         | Type              | Params | Mode
-----------------------------------------------------------
0 | loss         | MSE               | 0      | train
1 | valid_loss   | MSE               | 0      | train
2 | padder_train | ConstantPad1d     | 0      | train
3 | scaler       | TemporalNorm      | 0      | train
4 | model        | PatchTST_backbone | 339 K  | train
-----------------------------------------------------------
339 K     Trainable params
4         Non-trainable params
339 K     Total params
1.359     Total estimated model params size (MB)
116       Modules in train mode
0         Modules in eval mode
`Trainer.fit` stopped: `max_steps=1000` reached.
Trainer already configured with model summary callbacks: [<class 'pytorch_lightning.callbacks.model_summary.ModelSummary'>]. Skipping setting a default `ModelSummary` callback.
GPU available: True (cuda), used: True
TPU available: False, using: 0 TPU cores
HPU available: False, using: 0 HPUs
LOCAL_RANK: 0 - CUDA_VISIBLE_DEVICES: [0]
Seed set to 1
GPU available: True (cuda), used: True
TPU available: False, using: 0 TPU cores
HPU available: False, using: 0 HPUs
LOCAL_RANK: 0 - CUDA_VISIBLE_DEVICES: [0]

  | Name         | Type              | Params | Mode
-----------------------------------------------------------
0 | loss         | MSE               | 0      | train
1 | valid_loss   | MSE               | 0      | train
2 | padder_train | ConstantPad1d     | 0      | train
3 | scaler       | TemporalNorm      | 0      | train
4 | model        | PatchTST_backbone | 339 K  | train
-----------------------------------------------------------
339 K     Trainable params
4         Non-trainable params
339 K     Total params
1.359     Total estimated model params size (MB)
116       Modules in train mode
0         Modules in eval mode
`Trainer.fit` stopped: `max_steps=1000` reached.
Trainer already configured with model summary callbacks: [<class 'pytorch_lightning.callbacks.model_summary.ModelSummary'>]. Skipping setting a default `ModelSummary` callback.
GPU available: True (cuda), used: True
TPU available: False, using: 0 TPU cores
HPU available: False, using: 0 HPUs
LOCAL_RANK: 0 - CUDA_VISIBLE_DEVICES: [0]
Seed set to 1
GPU available: True (cuda), used: True
TPU available: False, using: 0 TPU cores
HPU available: False, using: 0 HPUs
LOCAL_RANK: 0 - CUDA_VISIBLE_DEVICES: [0]

  | Name         | Type              | Params | Mode
-----------------------------------------------------------
0 | loss         | MSE               | 0      | train
1 | valid_loss   | MSE               | 0      | train
2 | padder_train | ConstantPad1d     | 0      | train
3 | scaler       | TemporalNorm      | 0      | train
4 | model        | PatchTST_backbone | 339 K  | train
-----------------------------------------------------------
339 K     Trainable params
4         Non-trainable params
339 K     Total params
1.359     Total estimated model params size (MB)
116       Modules in train mode
0         Modules in eval mode
`Trainer.fit` stopped: `max_steps=1000` reached.
Trainer already configured with model summary callbacks: [<class 'pytorch_lightning.callbacks.model_summary.ModelSummary'>]. Skipping setting a default `ModelSummary` callback.
GPU available: True (cuda), used: True
TPU available: False, using: 0 TPU cores
HPU available: False, using: 0 HPUs
LOCAL_RANK: 0 - CUDA_VISIBLE_DEVICES: [0]
