[I 2026-03-21 23:38:59,853] A new study created in Journal with name: neuralforecast::brentoil_case3_HPT_n100::PatchTST::main-search::75bb066746ee
Seed set to 1
GPU available: True (cuda), used: True
TPU available: False, using: 0 TPU cores
HPU available: False, using: 0 HPUs
You are using a CUDA device ('NVIDIA RTX A5000') that has Tensor Cores. To properly utilize them, you should set `torch.set_float32_matmul_precision('medium' | 'high')` which will trade-off precision for performance. For more details, read https://pytorch.org/docs/stable/generated/torch.set_float32_matmul_precision.html#torch.set_float32_matmul_precision
LOCAL_RANK: 0 - CUDA_VISIBLE_DEVICES: [0]

  | Name         | Type              | Params | Mode
-----------------------------------------------------------
0 | loss         | MSE               | 0      | train
1 | valid_loss   | MSE               | 0      | train
2 | padder_train | ConstantPad1d     | 0      | train
3 | scaler       | TemporalNorm      | 0      | train
4 | model        | PatchTST_backbone | 448 K  | train
-----------------------------------------------------------
448 K     Trainable params
2         Non-trainable params
448 K     Total params
1.796     Total estimated model params size (MB)
66        Modules in train mode
0         Modules in eval mode
`Trainer.fit` stopped: `max_steps=1000` reached.
Trainer already configured with model summary callbacks: [<class 'pytorch_lightning.callbacks.model_summary.ModelSummary'>]. Skipping setting a default `ModelSummary` callback.
GPU available: True (cuda), used: True
TPU available: False, using: 0 TPU cores
HPU available: False, using: 0 HPUs
LOCAL_RANK: 0 - CUDA_VISIBLE_DEVICES: [0]
Seed set to 1
GPU available: True (cuda), used: True
TPU available: False, using: 0 TPU cores
HPU available: False, using: 0 HPUs
LOCAL_RANK: 0 - CUDA_VISIBLE_DEVICES: [0]

  | Name         | Type              | Params | Mode
-----------------------------------------------------------
0 | loss         | MSE               | 0      | train
1 | valid_loss   | MSE               | 0      | train
2 | padder_train | ConstantPad1d     | 0      | train
3 | scaler       | TemporalNorm      | 0      | train
4 | model        | PatchTST_backbone | 448 K  | train
-----------------------------------------------------------
448 K     Trainable params
2         Non-trainable params
448 K     Total params
1.796     Total estimated model params size (MB)
66        Modules in train mode
0         Modules in eval mode
`Trainer.fit` stopped: `max_steps=1000` reached.
Trainer already configured with model summary callbacks: [<class 'pytorch_lightning.callbacks.model_summary.ModelSummary'>]. Skipping setting a default `ModelSummary` callback.
GPU available: True (cuda), used: True
TPU available: False, using: 0 TPU cores
HPU available: False, using: 0 HPUs
LOCAL_RANK: 0 - CUDA_VISIBLE_DEVICES: [0]
Seed set to 1
GPU available: True (cuda), used: True
TPU available: False, using: 0 TPU cores
HPU available: False, using: 0 HPUs
LOCAL_RANK: 0 - CUDA_VISIBLE_DEVICES: [0]

  | Name         | Type              | Params | Mode
-----------------------------------------------------------
0 | loss         | MSE               | 0      | train
1 | valid_loss   | MSE               | 0      | train
2 | padder_train | ConstantPad1d     | 0      | train
3 | scaler       | TemporalNorm      | 0      | train
4 | model        | PatchTST_backbone | 448 K  | train
-----------------------------------------------------------
448 K     Trainable params
2         Non-trainable params
448 K     Total params
1.796     Total estimated model params size (MB)
66        Modules in train mode
0         Modules in eval mode
`Trainer.fit` stopped: `max_steps=1000` reached.
Trainer already configured with model summary callbacks: [<class 'pytorch_lightning.callbacks.model_summary.ModelSummary'>]. Skipping setting a default `ModelSummary` callback.
GPU available: True (cuda), used: True
TPU available: False, using: 0 TPU cores
HPU available: False, using: 0 HPUs
LOCAL_RANK: 0 - CUDA_VISIBLE_DEVICES: [0]
Seed set to 1
GPU available: True (cuda), used: True
TPU available: False, using: 0 TPU cores
HPU available: False, using: 0 HPUs
LOCAL_RANK: 0 - CUDA_VISIBLE_DEVICES: [0]

  | Name         | Type              | Params | Mode
-----------------------------------------------------------
0 | loss         | MSE               | 0      | train
1 | valid_loss   | MSE               | 0      | train
2 | padder_train | ConstantPad1d     | 0      | train
3 | scaler       | TemporalNorm      | 0      | train
4 | model        | PatchTST_backbone | 448 K  | train
-----------------------------------------------------------
448 K     Trainable params
2         Non-trainable params
448 K     Total params
1.796     Total estimated model params size (MB)
66        Modules in train mode
0         Modules in eval mode
`Trainer.fit` stopped: `max_steps=1000` reached.
Trainer already configured with model summary callbacks: [<class 'pytorch_lightning.callbacks.model_summary.ModelSummary'>]. Skipping setting a default `ModelSummary` callback.
GPU available: True (cuda), used: True
TPU available: False, using: 0 TPU cores
HPU available: False, using: 0 HPUs
LOCAL_RANK: 0 - CUDA_VISIBLE_DEVICES: [0]
Seed set to 1
GPU available: True (cuda), used: True
TPU available: False, using: 0 TPU cores
HPU available: False, using: 0 HPUs
LOCAL_RANK: 0 - CUDA_VISIBLE_DEVICES: [0]

  | Name         | Type              | Params | Mode
-----------------------------------------------------------
0 | loss         | MSE               | 0      | train
1 | valid_loss   | MSE               | 0      | train
2 | padder_train | ConstantPad1d     | 0      | train
3 | scaler       | TemporalNorm      | 0      | train
4 | model        | PatchTST_backbone | 448 K  | train
-----------------------------------------------------------
448 K     Trainable params
2         Non-trainable params
448 K     Total params
1.796     Total estimated model params size (MB)
66        Modules in train mode
0         Modules in eval mode
`Trainer.fit` stopped: `max_steps=1000` reached.
Trainer already configured with model summary callbacks: [<class 'pytorch_lightning.callbacks.model_summary.ModelSummary'>]. Skipping setting a default `ModelSummary` callback.
GPU available: True (cuda), used: True
TPU available: False, using: 0 TPU cores
HPU available: False, using: 0 HPUs
LOCAL_RANK: 0 - CUDA_VISIBLE_DEVICES: [0]
[I 2026-03-21 23:41:42,241] Trial 0 finished with value: 56.47572270215956 and parameters: {'hidden_size': 128, 'n_heads': 4, 'encoder_layers': 2, 'linear_hidden_size': 512, 'patch_len': 12, 'stride': 2, 'dropout': 0.1, 'fc_dropout': 0.1, 'attn_dropout': 0.1, 'revin': True, 'input_size': 96, 'learning_rate': 0.0019456617221882127, 'scaler_type': 'identity', 'model_step_size': 8}. Best is trial 0 with value: 56.47572270215956.
Seed set to 1
GPU available: True (cuda), used: True
TPU available: False, using: 0 TPU cores
HPU available: False, using: 0 HPUs
LOCAL_RANK: 0 - CUDA_VISIBLE_DEVICES: [0]

  | Name         | Type              | Params | Mode
-----------------------------------------------------------
0 | loss         | MSE               | 0      | train
1 | valid_loss   | MSE               | 0      | train
2 | padder_train | ConstantPad1d     | 0      | train
3 | scaler       | TemporalNorm      | 0      | train
4 | model        | PatchTST_backbone | 211 K  | train
-----------------------------------------------------------
211 K     Trainable params
2         Non-trainable params
211 K     Total params
0.845     Total estimated model params size (MB)
65        Modules in train mode
0         Modules in eval mode
`Trainer.fit` stopped: `max_steps=1000` reached.
Trainer already configured with model summary callbacks: [<class 'pytorch_lightning.callbacks.model_summary.ModelSummary'>]. Skipping setting a default `ModelSummary` callback.
GPU available: True (cuda), used: True
TPU available: False, using: 0 TPU cores
HPU available: False, using: 0 HPUs
LOCAL_RANK: 0 - CUDA_VISIBLE_DEVICES: [0]
Seed set to 1
GPU available: True (cuda), used: True
TPU available: False, using: 0 TPU cores
HPU available: False, using: 0 HPUs
LOCAL_RANK: 0 - CUDA_VISIBLE_DEVICES: [0]

  | Name         | Type              | Params | Mode
-----------------------------------------------------------
0 | loss         | MSE               | 0      | train
1 | valid_loss   | MSE               | 0      | train
2 | padder_train | ConstantPad1d     | 0      | train
3 | scaler       | TemporalNorm      | 0      | train
4 | model        | PatchTST_backbone | 211 K  | train
-----------------------------------------------------------
211 K     Trainable params
2         Non-trainable params
211 K     Total params
0.845     Total estimated model params size (MB)
65        Modules in train mode
0         Modules in eval mode
`Trainer.fit` stopped: `max_steps=1000` reached.
Trainer already configured with model summary callbacks: [<class 'pytorch_lightning.callbacks.model_summary.ModelSummary'>]. Skipping setting a default `ModelSummary` callback.
GPU available: True (cuda), used: True
TPU available: False, using: 0 TPU cores
HPU available: False, using: 0 HPUs
LOCAL_RANK: 0 - CUDA_VISIBLE_DEVICES: [0]
Seed set to 1
GPU available: True (cuda), used: True
TPU available: False, using: 0 TPU cores
HPU available: False, using: 0 HPUs
LOCAL_RANK: 0 - CUDA_VISIBLE_DEVICES: [0]

  | Name         | Type              | Params | Mode
-----------------------------------------------------------
0 | loss         | MSE               | 0      | train
1 | valid_loss   | MSE               | 0      | train
2 | padder_train | ConstantPad1d     | 0      | train
3 | scaler       | TemporalNorm      | 0      | train
4 | model        | PatchTST_backbone | 211 K  | train
-----------------------------------------------------------
211 K     Trainable params
2         Non-trainable params
211 K     Total params
0.845     Total estimated model params size (MB)
65        Modules in train mode
0         Modules in eval mode
`Trainer.fit` stopped: `max_steps=1000` reached.
Trainer already configured with model summary callbacks: [<class 'pytorch_lightning.callbacks.model_summary.ModelSummary'>]. Skipping setting a default `ModelSummary` callback.
GPU available: True (cuda), used: True
TPU available: False, using: 0 TPU cores
HPU available: False, using: 0 HPUs
LOCAL_RANK: 0 - CUDA_VISIBLE_DEVICES: [0]
Seed set to 1
GPU available: True (cuda), used: True
TPU available: False, using: 0 TPU cores
HPU available: False, using: 0 HPUs
LOCAL_RANK: 0 - CUDA_VISIBLE_DEVICES: [0]

  | Name         | Type              | Params | Mode
-----------------------------------------------------------
0 | loss         | MSE               | 0      | train
1 | valid_loss   | MSE               | 0      | train
2 | padder_train | ConstantPad1d     | 0      | train
3 | scaler       | TemporalNorm      | 0      | train
4 | model        | PatchTST_backbone | 211 K  | train
-----------------------------------------------------------
211 K     Trainable params
2         Non-trainable params
211 K     Total params
0.845     Total estimated model params size (MB)
65        Modules in train mode
0         Modules in eval mode
`Trainer.fit` stopped: `max_steps=1000` reached.
Trainer already configured with model summary callbacks: [<class 'pytorch_lightning.callbacks.model_summary.ModelSummary'>]. Skipping setting a default `ModelSummary` callback.
GPU available: True (cuda), used: True
TPU available: False, using: 0 TPU cores
HPU available: False, using: 0 HPUs
LOCAL_RANK: 0 - CUDA_VISIBLE_DEVICES: [0]
Seed set to 1
GPU available: True (cuda), used: True
TPU available: False, using: 0 TPU cores
HPU available: False, using: 0 HPUs
LOCAL_RANK: 0 - CUDA_VISIBLE_DEVICES: [0]

  | Name         | Type              | Params | Mode
-----------------------------------------------------------
0 | loss         | MSE               | 0      | train
1 | valid_loss   | MSE               | 0      | train
2 | padder_train | ConstantPad1d     | 0      | train
3 | scaler       | TemporalNorm      | 0      | train
4 | model        | PatchTST_backbone | 211 K  | train
-----------------------------------------------------------
211 K     Trainable params
2         Non-trainable params
211 K     Total params
0.845     Total estimated model params size (MB)
65        Modules in train mode
0         Modules in eval mode
`Trainer.fit` stopped: `max_steps=1000` reached.
Trainer already configured with model summary callbacks: [<class 'pytorch_lightning.callbacks.model_summary.ModelSummary'>]. Skipping setting a default `ModelSummary` callback.
GPU available: True (cuda), used: True
TPU available: False, using: 0 TPU cores
HPU available: False, using: 0 HPUs
LOCAL_RANK: 0 - CUDA_VISIBLE_DEVICES: [0]
[I 2026-03-21 23:42:36,472] Trial 1 finished with value: 94.09367910413991 and parameters: {'hidden_size': 128, 'n_heads': 8, 'encoder_layers': 2, 'linear_hidden_size': 128, 'patch_len': 4, 'stride': 4, 'dropout': 0.1, 'fc_dropout': 0.0, 'attn_dropout': 0.1, 'revin': False, 'input_size': 36, 'learning_rate': 0.0005357172699203351, 'scaler_type': None, 'model_step_size': 1}. Best is trial 0 with value: 56.47572270215956.
Seed set to 1
GPU available: True (cuda), used: True
TPU available: False, using: 0 TPU cores
HPU available: False, using: 0 HPUs
LOCAL_RANK: 0 - CUDA_VISIBLE_DEVICES: [0]

  | Name         | Type              | Params | Mode
-----------------------------------------------------------
0 | loss         | MSE               | 0      | train
1 | valid_loss   | MSE               | 0      | train
2 | padder_train | ConstantPad1d     | 0      | train
3 | scaler       | TemporalNorm      | 0      | train
4 | model        | PatchTST_backbone | 404 K  | train
-----------------------------------------------------------
404 K     Trainable params
3         Non-trainable params
404 K     Total params
1.617     Total estimated model params size (MB)
91        Modules in train mode
0         Modules in eval mode
`Trainer.fit` stopped: `max_steps=1000` reached.
Trainer already configured with model summary callbacks: [<class 'pytorch_lightning.callbacks.model_summary.ModelSummary'>]. Skipping setting a default `ModelSummary` callback.
GPU available: True (cuda), used: True
TPU available: False, using: 0 TPU cores
HPU available: False, using: 0 HPUs
LOCAL_RANK: 0 - CUDA_VISIBLE_DEVICES: [0]
Seed set to 1
GPU available: True (cuda), used: True
TPU available: False, using: 0 TPU cores
HPU available: False, using: 0 HPUs
LOCAL_RANK: 0 - CUDA_VISIBLE_DEVICES: [0]

  | Name         | Type              | Params | Mode
-----------------------------------------------------------
0 | loss         | MSE               | 0      | train
1 | valid_loss   | MSE               | 0      | train
2 | padder_train | ConstantPad1d     | 0      | train
3 | scaler       | TemporalNorm      | 0      | train
4 | model        | PatchTST_backbone | 404 K  | train
-----------------------------------------------------------
404 K     Trainable params
3         Non-trainable params
404 K     Total params
1.617     Total estimated model params size (MB)
91        Modules in train mode
0         Modules in eval mode
`Trainer.fit` stopped: `max_steps=1000` reached.
Trainer already configured with model summary callbacks: [<class 'pytorch_lightning.callbacks.model_summary.ModelSummary'>]. Skipping setting a default `ModelSummary` callback.
GPU available: True (cuda), used: True
TPU available: False, using: 0 TPU cores
HPU available: False, using: 0 HPUs
LOCAL_RANK: 0 - CUDA_VISIBLE_DEVICES: [0]
Seed set to 1
GPU available: True (cuda), used: True
TPU available: False, using: 0 TPU cores
HPU available: False, using: 0 HPUs
LOCAL_RANK: 0 - CUDA_VISIBLE_DEVICES: [0]

  | Name         | Type              | Params | Mode
-----------------------------------------------------------
0 | loss         | MSE               | 0      | train
1 | valid_loss   | MSE               | 0      | train
2 | padder_train | ConstantPad1d     | 0      | train
3 | scaler       | TemporalNorm      | 0      | train
4 | model        | PatchTST_backbone | 404 K  | train
-----------------------------------------------------------
404 K     Trainable params
3         Non-trainable params
404 K     Total params
1.617     Total estimated model params size (MB)
91        Modules in train mode
0         Modules in eval mode
`Trainer.fit` stopped: `max_steps=1000` reached.
Trainer already configured with model summary callbacks: [<class 'pytorch_lightning.callbacks.model_summary.ModelSummary'>]. Skipping setting a default `ModelSummary` callback.
GPU available: True (cuda), used: True
TPU available: False, using: 0 TPU cores
HPU available: False, using: 0 HPUs
LOCAL_RANK: 0 - CUDA_VISIBLE_DEVICES: [0]
Seed set to 1
GPU available: True (cuda), used: True
TPU available: False, using: 0 TPU cores
HPU available: False, using: 0 HPUs
LOCAL_RANK: 0 - CUDA_VISIBLE_DEVICES: [0]

  | Name         | Type              | Params | Mode
-----------------------------------------------------------
0 | loss         | MSE               | 0      | train
1 | valid_loss   | MSE               | 0      | train
2 | padder_train | ConstantPad1d     | 0      | train
3 | scaler       | TemporalNorm      | 0      | train
4 | model        | PatchTST_backbone | 404 K  | train
-----------------------------------------------------------
404 K     Trainable params
3         Non-trainable params
404 K     Total params
1.617     Total estimated model params size (MB)
91        Modules in train mode
0         Modules in eval mode
`Trainer.fit` stopped: `max_steps=1000` reached.
Trainer already configured with model summary callbacks: [<class 'pytorch_lightning.callbacks.model_summary.ModelSummary'>]. Skipping setting a default `ModelSummary` callback.
GPU available: True (cuda), used: True
TPU available: False, using: 0 TPU cores
HPU available: False, using: 0 HPUs
LOCAL_RANK: 0 - CUDA_VISIBLE_DEVICES: [0]
Seed set to 1
GPU available: True (cuda), used: True
TPU available: False, using: 0 TPU cores
HPU available: False, using: 0 HPUs
LOCAL_RANK: 0 - CUDA_VISIBLE_DEVICES: [0]

  | Name         | Type              | Params | Mode
-----------------------------------------------------------
0 | loss         | MSE               | 0      | train
1 | valid_loss   | MSE               | 0      | train
2 | padder_train | ConstantPad1d     | 0      | train
3 | scaler       | TemporalNorm      | 0      | train
4 | model        | PatchTST_backbone | 404 K  | train
-----------------------------------------------------------
404 K     Trainable params
3         Non-trainable params
404 K     Total params
1.617     Total estimated model params size (MB)
91        Modules in train mode
0         Modules in eval mode
`Trainer.fit` stopped: `max_steps=1000` reached.
Trainer already configured with model summary callbacks: [<class 'pytorch_lightning.callbacks.model_summary.ModelSummary'>]. Skipping setting a default `ModelSummary` callback.
GPU available: True (cuda), used: True
TPU available: False, using: 0 TPU cores
HPU available: False, using: 0 HPUs
LOCAL_RANK: 0 - CUDA_VISIBLE_DEVICES: [0]
