[I 2026-03-22 11:17:09,604] Trial 83 finished with value: 37.561976504249515 and parameters: {'n_estimators': 64, 'max_depth': 3, 'learning_rate': 0.02138442257441896, 'subsample': 0.8776023191113353, 'colsample_bytree': 0.5994838194783928}. Best is trial 56 with value: 37.530499990501745.
[I 2026-03-22 11:17:09,694] Trial 84 finished with value: 37.559008772289175 and parameters: {'n_estimators': 64, 'max_depth': 3, 'learning_rate': 0.03858733943925616, 'subsample': 0.9073398039140992, 'colsample_bytree': 0.6261982714399725}. Best is trial 56 with value: 37.530499990501745.
[I 2026-03-22 11:17:09,767] Trial 85 finished with value: 37.6648593305751 and parameters: {'n_estimators': 32, 'max_depth': 3, 'learning_rate': 0.018348083349739943, 'subsample': 0.7344778509444085, 'colsample_bytree': 0.516231385213307}. Best is trial 56 with value: 37.530499990501745.
[I 2026-03-22 11:17:09,854] Trial 86 finished with value: 37.551252431572095 and parameters: {'n_estimators': 64, 'max_depth': 3, 'learning_rate': 0.028132499092598077, 'subsample': 0.8674652868305032, 'colsample_bytree': 0.5663444771426324}. Best is trial 56 with value: 37.530499990501745.
[I 2026-03-22 11:17:09,936] Trial 87 finished with value: 37.60410452158173 and parameters: {'n_estimators': 64, 'max_depth': 2, 'learning_rate': 0.028166757840519693, 'subsample': 0.8704627749108997, 'colsample_bytree': 0.5775029533651423}. Best is trial 56 with value: 37.530499990501745.
[I 2026-03-22 11:17:10,014] Trial 88 finished with value: 37.558647300220926 and parameters: {'n_estimators': 64, 'max_depth': 3, 'learning_rate': 0.05025616347100878, 'subsample': 0.8912128030448883, 'colsample_bytree': 0.5090295739126808}. Best is trial 56 with value: 37.530499990501745.
[I 2026-03-22 11:17:10,094] Trial 89 finished with value: 37.60137793409532 and parameters: {'n_estimators': 64, 'max_depth': 3, 'learning_rate': 0.06317290603703278, 'subsample': 0.8808328079189186, 'colsample_bytree': 0.5353486076043392}. Best is trial 56 with value: 37.530499990501745.
[I 2026-03-22 11:17:10,173] Trial 90 finished with value: 37.53085380210225 and parameters: {'n_estimators': 64, 'max_depth': 4, 'learning_rate': 0.038559736027618606, 'subsample': 0.910787837754843, 'colsample_bytree': 0.5682563005926164}. Best is trial 56 with value: 37.530499990501745.
[I 2026-03-22 11:17:10,251] Trial 91 finished with value: 37.524433673306035 and parameters: {'n_estimators': 64, 'max_depth': 4, 'learning_rate': 0.028881244454762835, 'subsample': 0.9111236045456292, 'colsample_bytree': 0.5696079651659616}. Best is trial 91 with value: 37.524433673306035.
[I 2026-03-22 11:17:10,343] Trial 92 finished with value: 37.54039915790467 and parameters: {'n_estimators': 64, 'max_depth': 4, 'learning_rate': 0.03656544590039623, 'subsample': 0.9161566464577955, 'colsample_bytree': 0.5701486673694698}. Best is trial 91 with value: 37.524433673306035.
[I 2026-03-22 11:17:10,426] Trial 93 finished with value: 37.55454713914988 and parameters: {'n_estimators': 64, 'max_depth': 4, 'learning_rate': 0.03741880499052047, 'subsample': 0.9450289688098288, 'colsample_bytree': 0.5963970029300358}. Best is trial 91 with value: 37.524433673306035.
[I 2026-03-22 11:17:10,519] Trial 94 finished with value: 37.53824827600776 and parameters: {'n_estimators': 64, 'max_depth': 4, 'learning_rate': 0.037015050803857114, 'subsample': 0.9140947031302533, 'colsample_bytree': 0.6178987418079489}. Best is trial 91 with value: 37.524433673306035.
[I 2026-03-22 11:17:10,590] Trial 95 finished with value: 37.61276256925813 and parameters: {'n_estimators': 16, 'max_depth': 4, 'learning_rate': 0.04710878376697249, 'subsample': 0.908747550862555, 'colsample_bytree': 0.6167249599716125}. Best is trial 91 with value: 37.524433673306035.
[I 2026-03-22 11:17:10,672] Trial 96 finished with value: 37.59929794236889 and parameters: {'n_estimators': 64, 'max_depth': 4, 'learning_rate': 0.06057412553123976, 'subsample': 0.9200239012831656, 'colsample_bytree': 0.6519946372221357}. Best is trial 91 with value: 37.524433673306035.
[I 2026-03-22 11:17:10,773] Trial 97 finished with value: 37.58211231688174 and parameters: {'n_estimators': 64, 'max_depth': 4, 'learning_rate': 0.03641330269902907, 'subsample': 0.922909809922386, 'colsample_bytree': 0.5848451475635631}. Best is trial 91 with value: 37.524433673306035.
[I 2026-03-22 11:17:10,862] Trial 98 finished with value: 37.61313166909585 and parameters: {'n_estimators': 32, 'max_depth': 4, 'learning_rate': 0.03066043735760746, 'subsample': 0.974770338254102, 'colsample_bytree': 0.5710177196959711}. Best is trial 91 with value: 37.524433673306035.
[I 2026-03-22 11:17:10,954] Trial 99 finished with value: 37.59895686104669 and parameters: {'n_estimators': 64, 'max_depth': 4, 'learning_rate': 0.046472712325501236, 'subsample': 0.9424300620167341, 'colsample_bytree': 0.6042899568251079}. Best is trial 91 with value: 37.524433673306035.
[I 2026-03-22 11:17:11,051] Trial 100 finished with value: 37.51228166568565 and parameters: {'n_estimators': 64, 'max_depth': 4, 'learning_rate': 0.028021087788933897, 'subsample': 0.9136953701818966, 'colsample_bytree': 0.6285935855762405}. Best is trial 100 with value: 37.51228166568565.
[I 2026-03-22 11:17:11,130] Trial 101 finished with value: 37.52664731461546 and parameters: {'n_estimators': 64, 'max_depth': 4, 'learning_rate': 0.02641973230080252, 'subsample': 0.9127007060442969, 'colsample_bytree': 0.6289992326943377}. Best is trial 100 with value: 37.51228166568565.
[I 2026-03-22 11:17:11,224] Trial 102 finished with value: 37.512145360904746 and parameters: {'n_estimators': 64, 'max_depth': 4, 'learning_rate': 0.02743890308369624, 'subsample': 0.9141121777829205, 'colsample_bytree': 0.6356909910163185}. Best is trial 102 with value: 37.512145360904746.
[I 2026-03-22 11:17:11,309] Trial 103 finished with value: 37.526400109136674 and parameters: {'n_estimators': 64, 'max_depth': 4, 'learning_rate': 0.027844635885507216, 'subsample': 0.9565834355473908, 'colsample_bytree': 0.6342951643882693}. Best is trial 102 with value: 37.512145360904746.
[I 2026-03-22 11:17:11,395] Trial 104 finished with value: 37.52077165682469 and parameters: {'n_estimators': 64, 'max_depth': 4, 'learning_rate': 0.02808634247567212, 'subsample': 0.9567630187903969, 'colsample_bytree': 0.6292799683253462}. Best is trial 102 with value: 37.512145360904746.
[I 2026-03-22 11:17:11,487] Trial 105 finished with value: 37.52548132016291 and parameters: {'n_estimators': 64, 'max_depth': 4, 'learning_rate': 0.02752794362828357, 'subsample': 0.9567355559926222, 'colsample_bytree': 0.630180046842617}. Best is trial 102 with value: 37.512145360904746.
[I 2026-03-22 11:17:11,574] Trial 106 finished with value: 37.52586230583586 and parameters: {'n_estimators': 64, 'max_depth': 4, 'learning_rate': 0.027014450911101277, 'subsample': 0.9984756596077157, 'colsample_bytree': 0.6369531383875761}. Best is trial 102 with value: 37.512145360904746.
[I 2026-03-22 11:17:11,672] Trial 107 finished with value: 37.52372607932523 and parameters: {'n_estimators': 64, 'max_depth': 4, 'learning_rate': 0.027855283405081633, 'subsample': 0.9996651120287887, 'colsample_bytree': 0.6438731059906556}. Best is trial 102 with value: 37.512145360904746.
[I 2026-03-22 11:17:11,772] Trial 108 finished with value: 37.524910766390896 and parameters: {'n_estimators': 64, 'max_depth': 4, 'learning_rate': 0.015025899927408586, 'subsample': 0.9944935465788581, 'colsample_bytree': 0.6620919579724273}. Best is trial 102 with value: 37.512145360904746.
[I 2026-03-22 11:17:11,861] Trial 109 finished with value: 37.52134543565416 and parameters: {'n_estimators': 64, 'max_depth': 4, 'learning_rate': 0.01497470681188281, 'subsample': 0.9960295570074406, 'colsample_bytree': 0.6623212803716403}. Best is trial 102 with value: 37.512145360904746.
[I 2026-03-22 11:17:11,944] Trial 110 finished with value: 37.537200815165 and parameters: {'n_estimators': 64, 'max_depth': 4, 'learning_rate': 0.017655162136417987, 'subsample': 0.9808880673555743, 'colsample_bytree': 0.6592111270394538}. Best is trial 102 with value: 37.512145360904746.
[I 2026-03-22 11:17:12,036] Trial 111 finished with value: 37.52338211936064 and parameters: {'n_estimators': 64, 'max_depth': 4, 'learning_rate': 0.013309719483616445, 'subsample': 0.9976439437102362, 'colsample_bytree': 0.6383316110376029}. Best is trial 102 with value: 37.512145360904746.
[I 2026-03-22 11:17:12,129] Trial 112 finished with value: 37.52495627444163 and parameters: {'n_estimators': 64, 'max_depth': 4, 'learning_rate': 0.012894638771466517, 'subsample': 0.997233558968672, 'colsample_bytree': 0.6375429674628363}. Best is trial 102 with value: 37.512145360904746.
[I 2026-03-22 11:17:12,218] Trial 113 finished with value: 37.545066937921284 and parameters: {'n_estimators': 64, 'max_depth': 4, 'learning_rate': 0.010675725254188018, 'subsample': 0.9985558156843869, 'colsample_bytree': 0.6422063930358285}. Best is trial 102 with value: 37.512145360904746.
[I 2026-03-22 11:17:12,313] Trial 114 finished with value: 37.52469459517538 and parameters: {'n_estimators': 64, 'max_depth': 4, 'learning_rate': 0.013186477390126154, 'subsample': 0.99979699857341, 'colsample_bytree': 0.6800249365594646}. Best is trial 102 with value: 37.512145360904746.
[I 2026-03-22 11:17:12,374] Trial 115 finished with value: 37.65571210706012 and parameters: {'n_estimators': 16, 'max_depth': 4, 'learning_rate': 0.014184451072834588, 'subsample': 0.9888118876844448, 'colsample_bytree': 0.6800190291918298}. Best is trial 102 with value: 37.512145360904746.
[I 2026-03-22 11:17:12,457] Trial 116 finished with value: 37.5282992413979 and parameters: {'n_estimators': 64, 'max_depth': 4, 'learning_rate': 0.012412019862545304, 'subsample': 0.9981439577326988, 'colsample_bytree': 0.6656893468644755}. Best is trial 102 with value: 37.512145360904746.
[I 2026-03-22 11:17:12,559] Trial 117 finished with value: 37.54005911364296 and parameters: {'n_estimators': 64, 'max_depth': 4, 'learning_rate': 0.01446368261645567, 'subsample': 0.9647451464010698, 'colsample_bytree': 0.6524781101421383}. Best is trial 102 with value: 37.512145360904746.
[I 2026-03-22 11:17:12,633] Trial 118 finished with value: 37.64767820121728 and parameters: {'n_estimators': 32, 'max_depth': 4, 'learning_rate': 0.010192573463796623, 'subsample': 0.9790800243474536, 'colsample_bytree': 0.6718877984698477}. Best is trial 102 with value: 37.512145360904746.
[I 2026-03-22 11:17:12,723] Trial 119 finished with value: 37.51555984654004 and parameters: {'n_estimators': 64, 'max_depth': 4, 'learning_rate': 0.019183242325714132, 'subsample': 0.9913467838375901, 'colsample_bytree': 0.6448586876174344}. Best is trial 102 with value: 37.512145360904746.
[I 2026-03-22 11:17:12,818] Trial 120 finished with value: 37.53583389489059 and parameters: {'n_estimators': 64, 'max_depth': 4, 'learning_rate': 0.02275025590895939, 'subsample': 0.9849364713644639, 'colsample_bytree': 0.6768758801633209}. Best is trial 102 with value: 37.512145360904746.
[I 2026-03-22 11:17:12,919] Trial 121 finished with value: 37.51852417615832 and parameters: {'n_estimators': 64, 'max_depth': 4, 'learning_rate': 0.019494835805490527, 'subsample': 0.994187453101972, 'colsample_bytree': 0.6415664076286228}. Best is trial 102 with value: 37.512145360904746.
[I 2026-03-22 11:17:13,008] Trial 122 finished with value: 37.5742938872768 and parameters: {'n_estimators': 64, 'max_depth': 4, 'learning_rate': 0.007621052931784946, 'subsample': 0.9693125969662327, 'colsample_bytree': 0.6593839939181804}. Best is trial 102 with value: 37.512145360904746.
[I 2026-03-22 11:17:13,101] Trial 123 finished with value: 37.518677112582246 and parameters: {'n_estimators': 64, 'max_depth': 4, 'learning_rate': 0.019411116347081325, 'subsample': 0.9559724540210006, 'colsample_bytree': 0.6446942971856868}. Best is trial 102 with value: 37.512145360904746.
[I 2026-03-22 11:17:13,190] Trial 124 finished with value: 37.522194634974404 and parameters: {'n_estimators': 64, 'max_depth': 4, 'learning_rate': 0.018019071316954707, 'subsample': 0.9932926731510265, 'colsample_bytree': 0.6465088405351632}. Best is trial 102 with value: 37.512145360904746.
[I 2026-03-22 11:17:13,270] Trial 125 finished with value: 37.52179177488358 and parameters: {'n_estimators': 64, 'max_depth': 4, 'learning_rate': 0.01896607665946063, 'subsample': 0.9854179609307182, 'colsample_bytree': 0.6482453525598958}. Best is trial 102 with value: 37.512145360904746.
[I 2026-03-22 11:17:13,360] Trial 126 finished with value: 37.54672271060943 and parameters: {'n_estimators': 64, 'max_depth': 4, 'learning_rate': 0.018965685432586823, 'subsample': 0.975719996088297, 'colsample_bytree': 0.642389607926132}. Best is trial 102 with value: 37.512145360904746.
[I 2026-03-22 11:17:13,449] Trial 127 finished with value: 37.51946173202058 and parameters: {'n_estimators': 64, 'max_depth': 4, 'learning_rate': 0.01990151564241747, 'subsample': 0.9846279435801594, 'colsample_bytree': 0.6492939220736761}. Best is trial 102 with value: 37.512145360904746.
[I 2026-03-22 11:17:13,549] Trial 128 finished with value: 37.53070904445316 and parameters: {'n_estimators': 64, 'max_depth': 4, 'learning_rate': 0.01965223247941215, 'subsample': 0.9626433993889707, 'colsample_bytree': 0.6482157455777957}. Best is trial 102 with value: 37.512145360904746.
[I 2026-03-22 11:17:13,637] Trial 129 finished with value: 37.51820777841031 and parameters: {'n_estimators': 64, 'max_depth': 4, 'learning_rate': 0.018405575228875537, 'subsample': 0.9829530372318426, 'colsample_bytree': 0.6236252562457194}. Best is trial 102 with value: 37.512145360904746.
[I 2026-03-22 11:17:13,747] Trial 130 finished with value: 37.59778276040858 and parameters: {'n_estimators': 64, 'max_depth': 5, 'learning_rate': 0.016973028880366045, 'subsample': 0.9857691166932621, 'colsample_bytree': 0.6147833053267047}. Best is trial 102 with value: 37.512145360904746.
[I 2026-03-22 11:17:13,833] Trial 131 finished with value: 37.52798996505828 and parameters: {'n_estimators': 64, 'max_depth': 4, 'learning_rate': 0.022653623171596266, 'subsample': 0.9501327048371396, 'colsample_bytree': 0.621204836230243}. Best is trial 102 with value: 37.512145360904746.
[I 2026-03-22 11:17:13,930] Trial 132 finished with value: 37.530838861426545 and parameters: {'n_estimators': 64, 'max_depth': 4, 'learning_rate': 0.01885497506120267, 'subsample': 0.977664555766829, 'colsample_bytree': 0.6491824071512845}. Best is trial 102 with value: 37.512145360904746.
[I 2026-03-22 11:17:14,015] Trial 133 finished with value: 37.51312147934196 and parameters: {'n_estimators': 64, 'max_depth': 4, 'learning_rate': 0.02101453506285714, 'subsample': 0.9867120470742825, 'colsample_bytree': 0.6582772952938213}. Best is trial 102 with value: 37.512145360904746.
[I 2026-03-22 11:17:14,111] Trial 134 finished with value: 37.531671145385005 and parameters: {'n_estimators': 64, 'max_depth': 4, 'learning_rate': 0.021085691884720804, 'subsample': 0.9684626923733641, 'colsample_bytree': 0.6598238444058782}. Best is trial 102 with value: 37.512145360904746.
[I 2026-03-22 11:17:14,207] Trial 135 finished with value: 37.53391663481859 and parameters: {'n_estimators': 64, 'max_depth': 4, 'learning_rate': 0.02413083407787851, 'subsample': 0.9870530122149422, 'colsample_bytree': 0.6410666787734778}. Best is trial 102 with value: 37.512145360904746.
[I 2026-03-22 11:17:14,291] Trial 136 finished with value: 37.528587457979356 and parameters: {'n_estimators': 64, 'max_depth': 4, 'learning_rate': 0.015850066105239192, 'subsample': 0.9593665017056429, 'colsample_bytree': 0.6720957046641562}. Best is trial 102 with value: 37.512145360904746.
[I 2026-03-22 11:17:14,388] Trial 137 finished with value: 37.53851396087971 and parameters: {'n_estimators': 64, 'max_depth': 4, 'learning_rate': 0.018595615178426377, 'subsample': 0.9747111844660437, 'colsample_bytree': 0.6300663295861005}. Best is trial 102 with value: 37.512145360904746.
[I 2026-03-22 11:17:14,474] Trial 138 finished with value: 37.51962919043566 and parameters: {'n_estimators': 64, 'max_depth': 4, 'learning_rate': 0.016642434360096003, 'subsample': 0.9859825811651708, 'colsample_bytree': 0.6524016242323452}. Best is trial 102 with value: 37.512145360904746.
[I 2026-03-22 11:17:14,554] Trial 139 finished with value: 37.6522683396084 and parameters: {'n_estimators': 16, 'max_depth': 4, 'learning_rate': 0.016598594633971456, 'subsample': 0.9849875417791032, 'colsample_bytree': 0.6214425665322749}. Best is trial 102 with value: 37.512145360904746.
[I 2026-03-22 11:17:14,638] Trial 140 finished with value: 37.54864182214176 and parameters: {'n_estimators': 64, 'max_depth': 4, 'learning_rate': 0.0118161078774468, 'subsample': 0.9389527837984086, 'colsample_bytree': 0.6095818668333864}. Best is trial 102 with value: 37.512145360904746.
[I 2026-03-22 11:17:14,743] Trial 141 finished with value: 37.516344828303815 and parameters: {'n_estimators': 64, 'max_depth': 4, 'learning_rate': 0.020924353647780544, 'subsample': 0.9903509544473941, 'colsample_bytree': 0.6535186330616891}. Best is trial 102 with value: 37.512145360904746.
[I 2026-03-22 11:17:14,832] Trial 142 finished with value: 37.52001660629976 and parameters: {'n_estimators': 64, 'max_depth': 4, 'learning_rate': 0.020410891147144172, 'subsample': 0.9883624150661479, 'colsample_bytree': 0.6495663023309678}. Best is trial 102 with value: 37.512145360904746.
[I 2026-03-22 11:17:14,937] Trial 143 finished with value: 37.53329272067653 and parameters: {'n_estimators': 64, 'max_depth': 4, 'learning_rate': 0.02118870960215408, 'subsample': 0.9686013703257746, 'colsample_bytree': 0.6658757438318668}. Best is trial 102 with value: 37.512145360904746.
[I 2026-03-22 11:17:15,022] Trial 144 finished with value: 37.51743844926631 and parameters: {'n_estimators': 64, 'max_depth': 4, 'learning_rate': 0.017881968559868865, 'subsample': 0.9499720667412651, 'colsample_bytree': 0.6987761058516512}. Best is trial 102 with value: 37.512145360904746.
[I 2026-03-22 11:17:15,115] Trial 145 finished with value: 37.533475983035714 and parameters: {'n_estimators': 64, 'max_depth': 4, 'learning_rate': 0.023918837183755762, 'subsample': 0.9509491558318696, 'colsample_bytree': 0.7041612602094207}. Best is trial 102 with value: 37.512145360904746.
[I 2026-03-22 11:17:15,203] Trial 146 finished with value: 37.526501050057504 and parameters: {'n_estimators': 64, 'max_depth': 4, 'learning_rate': 0.01525429878650614, 'subsample': 0.9765474330873121, 'colsample_bytree': 0.9546119955829104}. Best is trial 102 with value: 37.512145360904746.
[I 2026-03-22 11:17:15,287] Trial 147 finished with value: 37.52800254617144 and parameters: {'n_estimators': 64, 'max_depth': 4, 'learning_rate': 0.02081572493957707, 'subsample': 0.9324226522782452, 'colsample_bytree': 0.6827445635409022}. Best is trial 102 with value: 37.512145360904746.
[I 2026-03-22 11:17:15,357] Trial 148 finished with value: 37.625206067329415 and parameters: {'n_estimators': 32, 'max_depth': 4, 'learning_rate': 0.02001704533731269, 'subsample': 0.9635988182343717, 'colsample_bytree': 0.6557723216567223}. Best is trial 102 with value: 37.512145360904746.
[I 2026-03-22 11:17:15,435] Trial 149 finished with value: 37.5234803072198 and parameters: {'n_estimators': 64, 'max_depth': 4, 'learning_rate': 0.017668811184174682, 'subsample': 0.9846980955922707, 'colsample_bytree': 0.6963497244967822}. Best is trial 102 with value: 37.512145360904746.
[I 2026-03-22 11:17:15,530] Trial 150 finished with value: 37.51536910567731 and parameters: {'n_estimators': 64, 'max_depth': 4, 'learning_rate': 0.02289760385310746, 'subsample': 0.9542309061395123, 'colsample_bytree': 0.670507458095258}. Best is trial 102 with value: 37.512145360904746.
[I 2026-03-22 11:17:15,609] Trial 151 finished with value: 37.526687502313976 and parameters: {'n_estimators': 64, 'max_depth': 4, 'learning_rate': 0.02247191521043323, 'subsample': 0.9525911740025448, 'colsample_bytree': 0.7219432469609841}. Best is trial 102 with value: 37.512145360904746.
[I 2026-03-22 11:17:15,701] Trial 152 finished with value: 37.548136878175136 and parameters: {'n_estimators': 64, 'max_depth': 4, 'learning_rate': 0.031810809307488315, 'subsample': 0.9715775587326758, 'colsample_bytree': 0.6677365638916979}. Best is trial 102 with value: 37.512145360904746.
[I 2026-03-22 11:17:15,794] Trial 153 finished with value: 37.53794930849195 and parameters: {'n_estimators': 64, 'max_depth': 4, 'learning_rate': 0.02529148875189589, 'subsample': 0.944014614696734, 'colsample_bytree': 0.6526408307416985}. Best is trial 102 with value: 37.512145360904746.
[I 2026-03-22 11:17:15,887] Trial 154 finished with value: 37.529962047798044 and parameters: {'n_estimators': 64, 'max_depth': 4, 'learning_rate': 0.01603810683765771, 'subsample': 0.9590071852934169, 'colsample_bytree': 0.6260900783222493}. Best is trial 102 with value: 37.512145360904746.
[I 2026-03-22 11:17:15,978] Trial 155 finished with value: 37.530048590481826 and parameters: {'n_estimators': 64, 'max_depth': 4, 'learning_rate': 0.02223663964461408, 'subsample': 0.9864720327930985, 'colsample_bytree': 0.6703589893836875}. Best is trial 102 with value: 37.512145360904746.
[I 2026-03-22 11:17:16,073] Trial 156 finished with value: 37.53183157863704 and parameters: {'n_estimators': 64, 'max_depth': 4, 'learning_rate': 0.019170342510718818, 'subsample': 0.9789052595956999, 'colsample_bytree': 0.6319837055826003}. Best is trial 102 with value: 37.512145360904746.
[I 2026-03-22 11:17:16,157] Trial 157 finished with value: 37.53502716612074 and parameters: {'n_estimators': 64, 'max_depth': 4, 'learning_rate': 0.01465552305148001, 'subsample': 0.9678631239491856, 'colsample_bytree': 0.656812673188571}. Best is trial 102 with value: 37.512145360904746.
