[I 2026-03-22 11:17:16,240] Trial 158 finished with value: 37.544946771339575 and parameters: {'n_estimators': 64, 'max_depth': 4, 'learning_rate': 0.024265105281582704, 'subsample': 0.9889460821935051, 'colsample_bytree': 0.6872185177363879}. Best is trial 102 with value: 37.512145360904746.
[I 2026-03-22 11:17:16,326] Trial 159 finished with value: 37.55379603625043 and parameters: {'n_estimators': 64, 'max_depth': 4, 'learning_rate': 0.031515689138582804, 'subsample': 0.9386743515137026, 'colsample_bytree': 0.6467119361556894}. Best is trial 102 with value: 37.512145360904746.
[I 2026-03-22 11:17:16,412] Trial 160 finished with value: 37.52229048942135 and parameters: {'n_estimators': 64, 'max_depth': 4, 'learning_rate': 0.01737296360746141, 'subsample': 0.9546807526560738, 'colsample_bytree': 0.675982375869187}. Best is trial 102 with value: 37.512145360904746.
[I 2026-03-22 11:17:16,501] Trial 161 finished with value: 37.520513926041666 and parameters: {'n_estimators': 64, 'max_depth': 4, 'learning_rate': 0.018289898405359994, 'subsample': 0.9876735135570524, 'colsample_bytree': 0.6490578355363796}. Best is trial 102 with value: 37.512145360904746.
[I 2026-03-22 11:17:16,588] Trial 162 finished with value: 37.54163666640796 and parameters: {'n_estimators': 64, 'max_depth': 4, 'learning_rate': 0.020833995009624184, 'subsample': 0.980472537223818, 'colsample_bytree': 0.6340090149454745}. Best is trial 102 with value: 37.512145360904746.
[I 2026-03-22 11:17:16,677] Trial 163 finished with value: 37.516317544251805 and parameters: {'n_estimators': 64, 'max_depth': 4, 'learning_rate': 0.018561932632280995, 'subsample': 0.9889105154458083, 'colsample_bytree': 0.6610606622063887}. Best is trial 102 with value: 37.512145360904746.
[I 2026-03-22 11:17:16,770] Trial 164 finished with value: 37.53119055089566 and parameters: {'n_estimators': 64, 'max_depth': 4, 'learning_rate': 0.01400125751209921, 'subsample': 0.9697113930666758, 'colsample_bytree': 0.6611810999941395}. Best is trial 102 with value: 37.512145360904746.
[I 2026-03-22 11:17:16,855] Trial 165 finished with value: 37.5296890287912 and parameters: {'n_estimators': 64, 'max_depth': 4, 'learning_rate': 0.016101215120641936, 'subsample': 0.9599990520435968, 'colsample_bytree': 0.6257514717838707}. Best is trial 102 with value: 37.512145360904746.
[I 2026-03-22 11:17:16,958] Trial 166 finished with value: 37.541245088318945 and parameters: {'n_estimators': 64, 'max_depth': 4, 'learning_rate': 0.024986071105296367, 'subsample': 0.991393276572864, 'colsample_bytree': 0.666443836298046}. Best is trial 102 with value: 37.512145360904746.
[I 2026-03-22 11:17:17,059] Trial 167 finished with value: 37.65039464416344 and parameters: {'n_estimators': 64, 'max_depth': 4, 'learning_rate': 0.0013185029977890168, 'subsample': 0.9786005834456535, 'colsample_bytree': 0.6531297237436455}. Best is trial 102 with value: 37.512145360904746.
[I 2026-03-22 11:17:17,142] Trial 168 finished with value: 37.61262940404187 and parameters: {'n_estimators': 64, 'max_depth': 4, 'learning_rate': 0.017371862169275845, 'subsample': 0.6467756339375231, 'colsample_bytree': 0.6177244883066679}. Best is trial 102 with value: 37.512145360904746.
[I 2026-03-22 11:17:17,211] Trial 169 finished with value: 37.64627230047893 and parameters: {'n_estimators': 16, 'max_depth': 4, 'learning_rate': 0.02119327583419428, 'subsample': 0.9488120679175813, 'colsample_bytree': 0.7577185290745567}. Best is trial 102 with value: 37.512145360904746.
[I 2026-03-22 11:17:17,305] Trial 170 finished with value: 37.551999926522505 and parameters: {'n_estimators': 64, 'max_depth': 4, 'learning_rate': 0.02919503738737275, 'subsample': 0.9298604418190892, 'colsample_bytree': 0.6416244887378099}. Best is trial 102 with value: 37.512145360904746.
[I 2026-03-22 11:17:17,394] Trial 171 finished with value: 37.51353119941431 and parameters: {'n_estimators': 64, 'max_depth': 4, 'learning_rate': 0.019337697586984965, 'subsample': 0.990086637382486, 'colsample_bytree': 0.6516032017283737}. Best is trial 102 with value: 37.512145360904746.
[I 2026-03-22 11:17:17,482] Trial 172 finished with value: 37.515580476018414 and parameters: {'n_estimators': 64, 'max_depth': 4, 'learning_rate': 0.01919373173688441, 'subsample': 0.9898143299755672, 'colsample_bytree': 0.6583233740262144}. Best is trial 102 with value: 37.512145360904746.
[I 2026-03-22 11:17:17,574] Trial 173 finished with value: 37.544069656465666 and parameters: {'n_estimators': 64, 'max_depth': 4, 'learning_rate': 0.01966674329471437, 'subsample': 0.97285834243589, 'colsample_bytree': 0.6371283176583945}. Best is trial 102 with value: 37.512145360904746.
[I 2026-03-22 11:17:17,662] Trial 174 finished with value: 37.531183900316 and parameters: {'n_estimators': 64, 'max_depth': 4, 'learning_rate': 0.022499223673004762, 'subsample': 0.9863353405564702, 'colsample_bytree': 0.6779208221959482}. Best is trial 102 with value: 37.512145360904746.
[I 2026-03-22 11:17:17,757] Trial 175 finished with value: 37.52057508337684 and parameters: {'n_estimators': 64, 'max_depth': 4, 'learning_rate': 0.025965620940957262, 'subsample': 0.9999811972395098, 'colsample_bytree': 0.6544134325102674}. Best is trial 102 with value: 37.512145360904746.
[I 2026-03-22 11:17:17,849] Trial 176 finished with value: 37.533809895004765 and parameters: {'n_estimators': 64, 'max_depth': 4, 'learning_rate': 0.025269066830634446, 'subsample': 0.990964098068206, 'colsample_bytree': 0.6528080548090177}. Best is trial 102 with value: 37.512145360904746.
[I 2026-03-22 11:17:17,956] Trial 177 finished with value: 37.784429928117255 and parameters: {'n_estimators': 64, 'max_depth': 6, 'learning_rate': 0.018825308664629958, 'subsample': 0.9767958797702319, 'colsample_bytree': 0.6990169497164452}. Best is trial 102 with value: 37.512145360904746.
[I 2026-03-22 11:17:18,043] Trial 178 finished with value: 37.625955939072696 and parameters: {'n_estimators': 32, 'max_depth': 4, 'learning_rate': 0.01694992650986763, 'subsample': 0.9901657028834375, 'colsample_bytree': 0.6704448300531032}. Best is trial 102 with value: 37.512145360904746.
[I 2026-03-22 11:17:18,127] Trial 179 finished with value: 37.5165558575391 and parameters: {'n_estimators': 64, 'max_depth': 4, 'learning_rate': 0.02256812947134728, 'subsample': 0.9994784998860713, 'colsample_bytree': 0.6453895071027317}. Best is trial 102 with value: 37.512145360904746.
[I 2026-03-22 11:17:18,213] Trial 180 finished with value: 37.53248515060608 and parameters: {'n_estimators': 64, 'max_depth': 4, 'learning_rate': 0.022893809395983226, 'subsample': 0.9656502700847557, 'colsample_bytree': 0.6412735949530517}. Best is trial 102 with value: 37.512145360904746.
[I 2026-03-22 11:17:18,298] Trial 181 finished with value: 37.509106637998386 and parameters: {'n_estimators': 64, 'max_depth': 4, 'learning_rate': 0.020554801485715774, 'subsample': 0.9992584492589438, 'colsample_bytree': 0.6584639699994405}. Best is trial 181 with value: 37.509106637998386.
[I 2026-03-22 11:17:18,385] Trial 182 finished with value: 37.526689279442806 and parameters: {'n_estimators': 64, 'max_depth': 4, 'learning_rate': 0.019998526866507566, 'subsample': 0.9819282031663082, 'colsample_bytree': 0.6459486709696861}. Best is trial 181 with value: 37.509106637998386.
[I 2026-03-22 11:17:18,475] Trial 183 finished with value: 37.50414276193775 and parameters: {'n_estimators': 64, 'max_depth': 4, 'learning_rate': 0.01807962320535872, 'subsample': 0.99873037695252, 'colsample_bytree': 0.6596548505154011}. Best is trial 183 with value: 37.50414276193775.
[I 2026-03-22 11:17:18,561] Trial 184 finished with value: 37.50680401168363 and parameters: {'n_estimators': 64, 'max_depth': 4, 'learning_rate': 0.021969772514279562, 'subsample': 0.9998050531756625, 'colsample_bytree': 0.6852714579718022}. Best is trial 183 with value: 37.50414276193775.
[I 2026-03-22 11:17:18,656] Trial 185 finished with value: 37.51264413405665 and parameters: {'n_estimators': 64, 'max_depth': 4, 'learning_rate': 0.015894011227513296, 'subsample': 0.998666299640811, 'colsample_bytree': 0.6792029231749862}. Best is trial 183 with value: 37.50414276193775.
[I 2026-03-22 11:17:18,760] Trial 186 finished with value: 37.53181343316278 and parameters: {'n_estimators': 64, 'max_depth': 4, 'learning_rate': 0.02256735859389675, 'subsample': 0.9943073787321148, 'colsample_bytree': 0.6905965928320201}. Best is trial 183 with value: 37.50414276193775.
[I 2026-03-22 11:17:18,844] Trial 187 finished with value: 37.5172312429622 and parameters: {'n_estimators': 64, 'max_depth': 4, 'learning_rate': 0.015315508772364135, 'subsample': 0.9994075338447188, 'colsample_bytree': 0.6821217059882754}. Best is trial 183 with value: 37.50414276193775.
[I 2026-03-22 11:17:18,937] Trial 188 finished with value: 37.52200722943424 and parameters: {'n_estimators': 64, 'max_depth': 4, 'learning_rate': 0.013645896655381524, 'subsample': 0.9995114883251202, 'colsample_bytree': 0.7062181330639513}. Best is trial 183 with value: 37.50414276193775.
[I 2026-03-22 11:17:19,028] Trial 189 finished with value: 37.514355260024935 and parameters: {'n_estimators': 64, 'max_depth': 4, 'learning_rate': 0.01550556491551219, 'subsample': 0.9981885630541933, 'colsample_bytree': 0.6914274787105477}. Best is trial 183 with value: 37.50414276193775.
[I 2026-03-22 11:17:19,110] Trial 190 finished with value: 37.52816976678108 and parameters: {'n_estimators': 64, 'max_depth': 4, 'learning_rate': 0.012382077508664121, 'subsample': 0.9992238698554515, 'colsample_bytree': 0.7186471349112856}. Best is trial 183 with value: 37.50414276193775.
[I 2026-03-22 11:17:19,198] Trial 191 finished with value: 37.52223142419352 and parameters: {'n_estimators': 64, 'max_depth': 4, 'learning_rate': 0.015331837279591694, 'subsample': 0.9768524551329704, 'colsample_bytree': 0.6843225544588138}. Best is trial 183 with value: 37.50414276193775.
[I 2026-03-22 11:17:19,279] Trial 192 finished with value: 37.50646153979707 and parameters: {'n_estimators': 64, 'max_depth': 4, 'learning_rate': 0.017611768232692025, 'subsample': 0.9981145814902366, 'colsample_bytree': 0.6944803200164824}. Best is trial 183 with value: 37.50414276193775.
[I 2026-03-22 11:17:19,370] Trial 193 finished with value: 37.54039430231317 and parameters: {'n_estimators': 64, 'max_depth': 4, 'learning_rate': 0.011149915423605737, 'subsample': 0.9976702359895023, 'colsample_bytree': 0.6951276853920029}. Best is trial 183 with value: 37.50414276193775.
[I 2026-03-22 11:17:19,448] Trial 194 finished with value: 37.51853059204241 and parameters: {'n_estimators': 64, 'max_depth': 4, 'learning_rate': 0.015560943684949206, 'subsample': 0.9911953152690746, 'colsample_bytree': 0.681382866098708}. Best is trial 183 with value: 37.50414276193775.
[I 2026-03-22 11:17:19,541] Trial 195 finished with value: 37.503505358803366 and parameters: {'n_estimators': 64, 'max_depth': 4, 'learning_rate': 0.01733693318161758, 'subsample': 0.9993279770750693, 'colsample_bytree': 0.7153016187728648}. Best is trial 195 with value: 37.503505358803366.
[I 2026-03-22 11:17:19,634] Trial 196 finished with value: 37.52333216766594 and parameters: {'n_estimators': 64, 'max_depth': 4, 'learning_rate': 0.013767398352476791, 'subsample': 0.9990991557416598, 'colsample_bytree': 0.7165108805183558}. Best is trial 195 with value: 37.503505358803366.
[I 2026-03-22 11:17:19,732] Trial 197 finished with value: 37.53839387105133 and parameters: {'n_estimators': 64, 'max_depth': 4, 'learning_rate': 0.01732943642465283, 'subsample': 0.9791276337656918, 'colsample_bytree': 0.7358230657921818}. Best is trial 195 with value: 37.503505358803366.
[I 2026-03-22 11:17:19,824] Trial 198 finished with value: 37.523920851606945 and parameters: {'n_estimators': 64, 'max_depth': 4, 'learning_rate': 0.015166443497863296, 'subsample': 0.9716272553397982, 'colsample_bytree': 0.7032876846954276}. Best is trial 195 with value: 37.503505358803366.
[I 2026-03-22 11:17:19,931] Trial 199 finished with value: 37.557491438081065 and parameters: {'n_estimators': 64, 'max_depth': 4, 'learning_rate': 0.023010570920072825, 'subsample': 0.981391724299012, 'colsample_bytree': 0.6916797150718602}. Best is trial 195 with value: 37.503505358803366.
