[I 2026-03-22 01:18:55,334] Trial 35 finished with value: 45.14169405901514 and parameters: {'hidden_size': 256, 'n_heads': 8, 'encoder_layers': 4, 'linear_hidden_size': 512, 'patch_len': 8, 'stride': 2, 'dropout': 0.3, 'fc_dropout': 0.0, 'attn_dropout': 0.1, 'revin': True, 'input_size': 96, 'learning_rate': 0.0007548393107880383, 'scaler_type': None, 'model_step_size': 1}. Best is trial 30 with value: 44.36483261971503.
Seed set to 1
GPU available: True (cuda), used: True
TPU available: False, using: 0 TPU cores
HPU available: False, using: 0 HPUs
LOCAL_RANK: 0 - CUDA_VISIBLE_DEVICES: [0]

  | Name         | Type              | Params | Mode
-----------------------------------------------------------
0 | loss         | MSE               | 0      | train
1 | valid_loss   | MSE               | 0      | train
2 | padder_train | ConstantPad1d     | 0      | train
3 | scaler       | TemporalNorm      | 0      | train
4 | model        | PatchTST_backbone | 359 K  | train
-----------------------------------------------------------
359 K     Trainable params
4         Non-trainable params
359 K     Total params
1.436     Total estimated model params size (MB)
116       Modules in train mode
0         Modules in eval mode
`Trainer.fit` stopped: `max_steps=1000` reached.
Trainer already configured with model summary callbacks: [<class 'pytorch_lightning.callbacks.model_summary.ModelSummary'>]. Skipping setting a default `ModelSummary` callback.
GPU available: True (cuda), used: True
TPU available: False, using: 0 TPU cores
HPU available: False, using: 0 HPUs
LOCAL_RANK: 0 - CUDA_VISIBLE_DEVICES: [0]
Seed set to 1
GPU available: True (cuda), used: True
TPU available: False, using: 0 TPU cores
HPU available: False, using: 0 HPUs
LOCAL_RANK: 0 - CUDA_VISIBLE_DEVICES: [0]

  | Name         | Type              | Params | Mode
-----------------------------------------------------------
0 | loss         | MSE               | 0      | train
1 | valid_loss   | MSE               | 0      | train
2 | padder_train | ConstantPad1d     | 0      | train
3 | scaler       | TemporalNorm      | 0      | train
4 | model        | PatchTST_backbone | 359 K  | train
-----------------------------------------------------------
359 K     Trainable params
4         Non-trainable params
359 K     Total params
1.436     Total estimated model params size (MB)
116       Modules in train mode
0         Modules in eval mode
`Trainer.fit` stopped: `max_steps=1000` reached.
Trainer already configured with model summary callbacks: [<class 'pytorch_lightning.callbacks.model_summary.ModelSummary'>]. Skipping setting a default `ModelSummary` callback.
GPU available: True (cuda), used: True
TPU available: False, using: 0 TPU cores
HPU available: False, using: 0 HPUs
LOCAL_RANK: 0 - CUDA_VISIBLE_DEVICES: [0]
Seed set to 1
GPU available: True (cuda), used: True
TPU available: False, using: 0 TPU cores
HPU available: False, using: 0 HPUs
LOCAL_RANK: 0 - CUDA_VISIBLE_DEVICES: [0]

  | Name         | Type              | Params | Mode
-----------------------------------------------------------
0 | loss         | MSE               | 0      | train
1 | valid_loss   | MSE               | 0      | train
2 | padder_train | ConstantPad1d     | 0      | train
3 | scaler       | TemporalNorm      | 0      | train
4 | model        | PatchTST_backbone | 359 K  | train
-----------------------------------------------------------
359 K     Trainable params
4         Non-trainable params
359 K     Total params
1.436     Total estimated model params size (MB)
116       Modules in train mode
0         Modules in eval mode
`Trainer.fit` stopped: `max_steps=1000` reached.
Trainer already configured with model summary callbacks: [<class 'pytorch_lightning.callbacks.model_summary.ModelSummary'>]. Skipping setting a default `ModelSummary` callback.
GPU available: True (cuda), used: True
TPU available: False, using: 0 TPU cores
HPU available: False, using: 0 HPUs
LOCAL_RANK: 0 - CUDA_VISIBLE_DEVICES: [0]
Seed set to 1
GPU available: True (cuda), used: True
TPU available: False, using: 0 TPU cores
HPU available: False, using: 0 HPUs
LOCAL_RANK: 0 - CUDA_VISIBLE_DEVICES: [0]

  | Name         | Type              | Params | Mode
-----------------------------------------------------------
0 | loss         | MSE               | 0      | train
1 | valid_loss   | MSE               | 0      | train
2 | padder_train | ConstantPad1d     | 0      | train
3 | scaler       | TemporalNorm      | 0      | train
4 | model        | PatchTST_backbone | 359 K  | train
-----------------------------------------------------------
359 K     Trainable params
4         Non-trainable params
359 K     Total params
1.436     Total estimated model params size (MB)
116       Modules in train mode
0         Modules in eval mode
`Trainer.fit` stopped: `max_steps=1000` reached.
Trainer already configured with model summary callbacks: [<class 'pytorch_lightning.callbacks.model_summary.ModelSummary'>]. Skipping setting a default `ModelSummary` callback.
GPU available: True (cuda), used: True
TPU available: False, using: 0 TPU cores
HPU available: False, using: 0 HPUs
LOCAL_RANK: 0 - CUDA_VISIBLE_DEVICES: [0]
Seed set to 1
GPU available: True (cuda), used: True
TPU available: False, using: 0 TPU cores
HPU available: False, using: 0 HPUs
LOCAL_RANK: 0 - CUDA_VISIBLE_DEVICES: [0]

  | Name         | Type              | Params | Mode
-----------------------------------------------------------
0 | loss         | MSE               | 0      | train
1 | valid_loss   | MSE               | 0      | train
2 | padder_train | ConstantPad1d     | 0      | train
3 | scaler       | TemporalNorm      | 0      | train
4 | model        | PatchTST_backbone | 359 K  | train
-----------------------------------------------------------
359 K     Trainable params
4         Non-trainable params
359 K     Total params
1.436     Total estimated model params size (MB)
116       Modules in train mode
0         Modules in eval mode
`Trainer.fit` stopped: `max_steps=1000` reached.
Trainer already configured with model summary callbacks: [<class 'pytorch_lightning.callbacks.model_summary.ModelSummary'>]. Skipping setting a default `ModelSummary` callback.
GPU available: True (cuda), used: True
TPU available: False, using: 0 TPU cores
HPU available: False, using: 0 HPUs
LOCAL_RANK: 0 - CUDA_VISIBLE_DEVICES: [0]
[I 2026-03-22 01:22:48,239] Trial 36 finished with value: 50.77642213730796 and parameters: {'hidden_size': 64, 'n_heads': 4, 'encoder_layers': 4, 'linear_hidden_size': 512, 'patch_len': 8, 'stride': 2, 'dropout': 0.2, 'fc_dropout': 0.0, 'attn_dropout': 0.1, 'revin': True, 'input_size': 96, 'learning_rate': 0.0006874789807458485, 'scaler_type': 'standard', 'model_step_size': 1}. Best is trial 30 with value: 44.36483261971503.
Seed set to 1
GPU available: True (cuda), used: True
TPU available: False, using: 0 TPU cores
HPU available: False, using: 0 HPUs
LOCAL_RANK: 0 - CUDA_VISIBLE_DEVICES: [0]

  | Name         | Type              | Params | Mode
-----------------------------------------------------------
0 | loss         | MSE               | 0      | train
1 | valid_loss   | MSE               | 0      | train
2 | padder_train | ConstantPad1d     | 0      | train
3 | scaler       | TemporalNorm      | 0      | train
4 | model        | PatchTST_backbone | 359 K  | train
-----------------------------------------------------------
359 K     Trainable params
4         Non-trainable params
359 K     Total params
1.436     Total estimated model params size (MB)
116       Modules in train mode
0         Modules in eval mode
`Trainer.fit` stopped: `max_steps=1000` reached.
Trainer already configured with model summary callbacks: [<class 'pytorch_lightning.callbacks.model_summary.ModelSummary'>]. Skipping setting a default `ModelSummary` callback.
GPU available: True (cuda), used: True
TPU available: False, using: 0 TPU cores
HPU available: False, using: 0 HPUs
LOCAL_RANK: 0 - CUDA_VISIBLE_DEVICES: [0]
Seed set to 1
GPU available: True (cuda), used: True
TPU available: False, using: 0 TPU cores
HPU available: False, using: 0 HPUs
LOCAL_RANK: 0 - CUDA_VISIBLE_DEVICES: [0]

  | Name         | Type              | Params | Mode
-----------------------------------------------------------
0 | loss         | MSE               | 0      | train
1 | valid_loss   | MSE               | 0      | train
2 | padder_train | ConstantPad1d     | 0      | train
3 | scaler       | TemporalNorm      | 0      | train
4 | model        | PatchTST_backbone | 359 K  | train
-----------------------------------------------------------
359 K     Trainable params
4         Non-trainable params
359 K     Total params
1.436     Total estimated model params size (MB)
116       Modules in train mode
0         Modules in eval mode
`Trainer.fit` stopped: `max_steps=1000` reached.
Trainer already configured with model summary callbacks: [<class 'pytorch_lightning.callbacks.model_summary.ModelSummary'>]. Skipping setting a default `ModelSummary` callback.
GPU available: True (cuda), used: True
TPU available: False, using: 0 TPU cores
HPU available: False, using: 0 HPUs
LOCAL_RANK: 0 - CUDA_VISIBLE_DEVICES: [0]
Seed set to 1
GPU available: True (cuda), used: True
TPU available: False, using: 0 TPU cores
HPU available: False, using: 0 HPUs
LOCAL_RANK: 0 - CUDA_VISIBLE_DEVICES: [0]

  | Name         | Type              | Params | Mode
-----------------------------------------------------------
0 | loss         | MSE               | 0      | train
1 | valid_loss   | MSE               | 0      | train
2 | padder_train | ConstantPad1d     | 0      | train
3 | scaler       | TemporalNorm      | 0      | train
4 | model        | PatchTST_backbone | 359 K  | train
-----------------------------------------------------------
359 K     Trainable params
4         Non-trainable params
359 K     Total params
1.436     Total estimated model params size (MB)
116       Modules in train mode
0         Modules in eval mode
`Trainer.fit` stopped: `max_steps=1000` reached.
Trainer already configured with model summary callbacks: [<class 'pytorch_lightning.callbacks.model_summary.ModelSummary'>]. Skipping setting a default `ModelSummary` callback.
GPU available: True (cuda), used: True
TPU available: False, using: 0 TPU cores
HPU available: False, using: 0 HPUs
LOCAL_RANK: 0 - CUDA_VISIBLE_DEVICES: [0]
Seed set to 1
GPU available: True (cuda), used: True
TPU available: False, using: 0 TPU cores
HPU available: False, using: 0 HPUs
LOCAL_RANK: 0 - CUDA_VISIBLE_DEVICES: [0]

  | Name         | Type              | Params | Mode
-----------------------------------------------------------
0 | loss         | MSE               | 0      | train
1 | valid_loss   | MSE               | 0      | train
2 | padder_train | ConstantPad1d     | 0      | train
3 | scaler       | TemporalNorm      | 0      | train
4 | model        | PatchTST_backbone | 359 K  | train
-----------------------------------------------------------
359 K     Trainable params
4         Non-trainable params
359 K     Total params
1.436     Total estimated model params size (MB)
116       Modules in train mode
0         Modules in eval mode
`Trainer.fit` stopped: `max_steps=1000` reached.
Trainer already configured with model summary callbacks: [<class 'pytorch_lightning.callbacks.model_summary.ModelSummary'>]. Skipping setting a default `ModelSummary` callback.
GPU available: True (cuda), used: True
TPU available: False, using: 0 TPU cores
HPU available: False, using: 0 HPUs
LOCAL_RANK: 0 - CUDA_VISIBLE_DEVICES: [0]
Seed set to 1
GPU available: True (cuda), used: True
TPU available: False, using: 0 TPU cores
HPU available: False, using: 0 HPUs
LOCAL_RANK: 0 - CUDA_VISIBLE_DEVICES: [0]

  | Name         | Type              | Params | Mode
-----------------------------------------------------------
0 | loss         | MSE               | 0      | train
1 | valid_loss   | MSE               | 0      | train
2 | padder_train | ConstantPad1d     | 0      | train
3 | scaler       | TemporalNorm      | 0      | train
4 | model        | PatchTST_backbone | 359 K  | train
-----------------------------------------------------------
359 K     Trainable params
4         Non-trainable params
359 K     Total params
1.436     Total estimated model params size (MB)
116       Modules in train mode
0         Modules in eval mode
`Trainer.fit` stopped: `max_steps=1000` reached.
Trainer already configured with model summary callbacks: [<class 'pytorch_lightning.callbacks.model_summary.ModelSummary'>]. Skipping setting a default `ModelSummary` callback.
GPU available: True (cuda), used: True
TPU available: False, using: 0 TPU cores
HPU available: False, using: 0 HPUs
LOCAL_RANK: 0 - CUDA_VISIBLE_DEVICES: [0]
[I 2026-03-22 01:26:34,370] Trial 37 finished with value: 53.262062017095424 and parameters: {'hidden_size': 64, 'n_heads': 4, 'encoder_layers': 4, 'linear_hidden_size': 512, 'patch_len': 8, 'stride': 2, 'dropout': 0.2, 'fc_dropout': 0.0, 'attn_dropout': 0.0, 'revin': True, 'input_size': 96, 'learning_rate': 0.0006777943027355997, 'scaler_type': None, 'model_step_size': 1}. Best is trial 30 with value: 44.36483261971503.
Seed set to 1
GPU available: True (cuda), used: True
TPU available: False, using: 0 TPU cores
HPU available: False, using: 0 HPUs
LOCAL_RANK: 0 - CUDA_VISIBLE_DEVICES: [0]

  | Name         | Type              | Params | Mode
-----------------------------------------------------------
0 | loss         | MSE               | 0      | train
1 | valid_loss   | MSE               | 0      | train
2 | padder_train | ConstantPad1d     | 0      | train
3 | scaler       | TemporalNorm      | 0      | train
4 | model        | PatchTST_backbone | 357 K  | train
-----------------------------------------------------------
357 K     Trainable params
4         Non-trainable params
357 K     Total params
1.429     Total estimated model params size (MB)
116       Modules in train mode
0         Modules in eval mode
`Trainer.fit` stopped: `max_steps=1000` reached.
Trainer already configured with model summary callbacks: [<class 'pytorch_lightning.callbacks.model_summary.ModelSummary'>]. Skipping setting a default `ModelSummary` callback.
GPU available: True (cuda), used: True
TPU available: False, using: 0 TPU cores
HPU available: False, using: 0 HPUs
LOCAL_RANK: 0 - CUDA_VISIBLE_DEVICES: [0]
Seed set to 1
GPU available: True (cuda), used: True
TPU available: False, using: 0 TPU cores
HPU available: False, using: 0 HPUs
LOCAL_RANK: 0 - CUDA_VISIBLE_DEVICES: [0]

  | Name         | Type              | Params | Mode
-----------------------------------------------------------
0 | loss         | MSE               | 0      | train
1 | valid_loss   | MSE               | 0      | train
2 | padder_train | ConstantPad1d     | 0      | train
3 | scaler       | TemporalNorm      | 0      | train
4 | model        | PatchTST_backbone | 357 K  | train
-----------------------------------------------------------
357 K     Trainable params
4         Non-trainable params
357 K     Total params
1.429     Total estimated model params size (MB)
116       Modules in train mode
0         Modules in eval mode
`Trainer.fit` stopped: `max_steps=1000` reached.
Trainer already configured with model summary callbacks: [<class 'pytorch_lightning.callbacks.model_summary.ModelSummary'>]. Skipping setting a default `ModelSummary` callback.
GPU available: True (cuda), used: True
TPU available: False, using: 0 TPU cores
HPU available: False, using: 0 HPUs
LOCAL_RANK: 0 - CUDA_VISIBLE_DEVICES: [0]
Seed set to 1
GPU available: True (cuda), used: True
TPU available: False, using: 0 TPU cores
HPU available: False, using: 0 HPUs
LOCAL_RANK: 0 - CUDA_VISIBLE_DEVICES: [0]

  | Name         | Type              | Params | Mode
-----------------------------------------------------------
0 | loss         | MSE               | 0      | train
1 | valid_loss   | MSE               | 0      | train
2 | padder_train | ConstantPad1d     | 0      | train
3 | scaler       | TemporalNorm      | 0      | train
4 | model        | PatchTST_backbone | 357 K  | train
-----------------------------------------------------------
357 K     Trainable params
4         Non-trainable params
357 K     Total params
1.429     Total estimated model params size (MB)
116       Modules in train mode
0         Modules in eval mode
`Trainer.fit` stopped: `max_steps=1000` reached.
Trainer already configured with model summary callbacks: [<class 'pytorch_lightning.callbacks.model_summary.ModelSummary'>]. Skipping setting a default `ModelSummary` callback.
GPU available: True (cuda), used: True
TPU available: False, using: 0 TPU cores
HPU available: False, using: 0 HPUs
LOCAL_RANK: 0 - CUDA_VISIBLE_DEVICES: [0]
Seed set to 1
GPU available: True (cuda), used: True
TPU available: False, using: 0 TPU cores
HPU available: False, using: 0 HPUs
LOCAL_RANK: 0 - CUDA_VISIBLE_DEVICES: [0]

  | Name         | Type              | Params | Mode
-----------------------------------------------------------
0 | loss         | MSE               | 0      | train
1 | valid_loss   | MSE               | 0      | train
2 | padder_train | ConstantPad1d     | 0      | train
3 | scaler       | TemporalNorm      | 0      | train
4 | model        | PatchTST_backbone | 357 K  | train
-----------------------------------------------------------
357 K     Trainable params
4         Non-trainable params
357 K     Total params
1.429     Total estimated model params size (MB)
116       Modules in train mode
0         Modules in eval mode
`Trainer.fit` stopped: `max_steps=1000` reached.
Trainer already configured with model summary callbacks: [<class 'pytorch_lightning.callbacks.model_summary.ModelSummary'>]. Skipping setting a default `ModelSummary` callback.
GPU available: True (cuda), used: True
TPU available: False, using: 0 TPU cores
HPU available: False, using: 0 HPUs
LOCAL_RANK: 0 - CUDA_VISIBLE_DEVICES: [0]
Seed set to 1
GPU available: True (cuda), used: True
TPU available: False, using: 0 TPU cores
HPU available: False, using: 0 HPUs
LOCAL_RANK: 0 - CUDA_VISIBLE_DEVICES: [0]

  | Name         | Type              | Params | Mode
-----------------------------------------------------------
0 | loss         | MSE               | 0      | train
1 | valid_loss   | MSE               | 0      | train
2 | padder_train | ConstantPad1d     | 0      | train
3 | scaler       | TemporalNorm      | 0      | train
4 | model        | PatchTST_backbone | 357 K  | train
-----------------------------------------------------------
357 K     Trainable params
4         Non-trainable params
357 K     Total params
1.429     Total estimated model params size (MB)
116       Modules in train mode
0         Modules in eval mode
`Trainer.fit` stopped: `max_steps=1000` reached.
Trainer already configured with model summary callbacks: [<class 'pytorch_lightning.callbacks.model_summary.ModelSummary'>]. Skipping setting a default `ModelSummary` callback.
GPU available: True (cuda), used: True
TPU available: False, using: 0 TPU cores
HPU available: False, using: 0 HPUs
LOCAL_RANK: 0 - CUDA_VISIBLE_DEVICES: [0]
