[I 2026-03-22 00:18:25,426] Trial 20 finished with value: 62.36911327732232 and parameters: {'hidden_size': 256, 'n_heads': 8, 'encoder_layers': 3, 'linear_hidden_size': 256, 'patch_len': 12, 'stride': 2, 'dropout': 0.2, 'fc_dropout': 0.2, 'attn_dropout': 0.1, 'revin': True, 'input_size': 72, 'learning_rate': 0.0006975830056605035, 'scaler_type': None, 'model_step_size': 4}. Best is trial 14 with value: 47.868384326726456.
Seed set to 1
GPU available: True (cuda), used: True
TPU available: False, using: 0 TPU cores
HPU available: False, using: 0 HPUs
LOCAL_RANK: 0 - CUDA_VISIBLE_DEVICES: [0]

  | Name         | Type              | Params | Mode
-----------------------------------------------------------
0 | loss         | MSE               | 0      | train
1 | valid_loss   | MSE               | 0      | train
2 | padder_train | ConstantPad1d     | 0      | train
3 | scaler       | TemporalNorm      | 0      | train
4 | model        | PatchTST_backbone | 1.0 M  | train
-----------------------------------------------------------
1.0 M     Trainable params
3         Non-trainable params
1.0 M     Total params
4.063     Total estimated model params size (MB)
90        Modules in train mode
0         Modules in eval mode
`Trainer.fit` stopped: `max_steps=1000` reached.
Trainer already configured with model summary callbacks: [<class 'pytorch_lightning.callbacks.model_summary.ModelSummary'>]. Skipping setting a default `ModelSummary` callback.
GPU available: True (cuda), used: True
TPU available: False, using: 0 TPU cores
HPU available: False, using: 0 HPUs
LOCAL_RANK: 0 - CUDA_VISIBLE_DEVICES: [0]
Seed set to 1
GPU available: True (cuda), used: True
TPU available: False, using: 0 TPU cores
HPU available: False, using: 0 HPUs
LOCAL_RANK: 0 - CUDA_VISIBLE_DEVICES: [0]

  | Name         | Type              | Params | Mode
-----------------------------------------------------------
0 | loss         | MSE               | 0      | train
1 | valid_loss   | MSE               | 0      | train
2 | padder_train | ConstantPad1d     | 0      | train
3 | scaler       | TemporalNorm      | 0      | train
4 | model        | PatchTST_backbone | 1.0 M  | train
-----------------------------------------------------------
1.0 M     Trainable params
3         Non-trainable params
1.0 M     Total params
4.063     Total estimated model params size (MB)
90        Modules in train mode
0         Modules in eval mode
`Trainer.fit` stopped: `max_steps=1000` reached.
Trainer already configured with model summary callbacks: [<class 'pytorch_lightning.callbacks.model_summary.ModelSummary'>]. Skipping setting a default `ModelSummary` callback.
GPU available: True (cuda), used: True
TPU available: False, using: 0 TPU cores
HPU available: False, using: 0 HPUs
LOCAL_RANK: 0 - CUDA_VISIBLE_DEVICES: [0]
Seed set to 1
GPU available: True (cuda), used: True
TPU available: False, using: 0 TPU cores
HPU available: False, using: 0 HPUs
LOCAL_RANK: 0 - CUDA_VISIBLE_DEVICES: [0]

  | Name         | Type              | Params | Mode
-----------------------------------------------------------
0 | loss         | MSE               | 0      | train
1 | valid_loss   | MSE               | 0      | train
2 | padder_train | ConstantPad1d     | 0      | train
3 | scaler       | TemporalNorm      | 0      | train
4 | model        | PatchTST_backbone | 1.0 M  | train
-----------------------------------------------------------
1.0 M     Trainable params
3         Non-trainable params
1.0 M     Total params
4.063     Total estimated model params size (MB)
90        Modules in train mode
0         Modules in eval mode
`Trainer.fit` stopped: `max_steps=1000` reached.
Trainer already configured with model summary callbacks: [<class 'pytorch_lightning.callbacks.model_summary.ModelSummary'>]. Skipping setting a default `ModelSummary` callback.
GPU available: True (cuda), used: True
TPU available: False, using: 0 TPU cores
HPU available: False, using: 0 HPUs
LOCAL_RANK: 0 - CUDA_VISIBLE_DEVICES: [0]
Seed set to 1
GPU available: True (cuda), used: True
TPU available: False, using: 0 TPU cores
HPU available: False, using: 0 HPUs
LOCAL_RANK: 0 - CUDA_VISIBLE_DEVICES: [0]

  | Name         | Type              | Params | Mode
-----------------------------------------------------------
0 | loss         | MSE               | 0      | train
1 | valid_loss   | MSE               | 0      | train
2 | padder_train | ConstantPad1d     | 0      | train
3 | scaler       | TemporalNorm      | 0      | train
4 | model        | PatchTST_backbone | 1.0 M  | train
-----------------------------------------------------------
1.0 M     Trainable params
3         Non-trainable params
1.0 M     Total params
4.063     Total estimated model params size (MB)
90        Modules in train mode
0         Modules in eval mode
`Trainer.fit` stopped: `max_steps=1000` reached.
Trainer already configured with model summary callbacks: [<class 'pytorch_lightning.callbacks.model_summary.ModelSummary'>]. Skipping setting a default `ModelSummary` callback.
GPU available: True (cuda), used: True
TPU available: False, using: 0 TPU cores
HPU available: False, using: 0 HPUs
LOCAL_RANK: 0 - CUDA_VISIBLE_DEVICES: [0]
Seed set to 1
GPU available: True (cuda), used: True
TPU available: False, using: 0 TPU cores
HPU available: False, using: 0 HPUs
LOCAL_RANK: 0 - CUDA_VISIBLE_DEVICES: [0]

  | Name         | Type              | Params | Mode
-----------------------------------------------------------
0 | loss         | MSE               | 0      | train
1 | valid_loss   | MSE               | 0      | train
2 | padder_train | ConstantPad1d     | 0      | train
3 | scaler       | TemporalNorm      | 0      | train
4 | model        | PatchTST_backbone | 1.0 M  | train
-----------------------------------------------------------
1.0 M     Trainable params
3         Non-trainable params
1.0 M     Total params
4.063     Total estimated model params size (MB)
90        Modules in train mode
0         Modules in eval mode
`Trainer.fit` stopped: `max_steps=1000` reached.
Trainer already configured with model summary callbacks: [<class 'pytorch_lightning.callbacks.model_summary.ModelSummary'>]. Skipping setting a default `ModelSummary` callback.
GPU available: True (cuda), used: True
TPU available: False, using: 0 TPU cores
HPU available: False, using: 0 HPUs
LOCAL_RANK: 0 - CUDA_VISIBLE_DEVICES: [0]
[I 2026-03-22 00:20:12,982] Trial 21 finished with value: 54.50845087421336 and parameters: {'hidden_size': 256, 'n_heads': 8, 'encoder_layers': 3, 'linear_hidden_size': 128, 'patch_len': 8, 'stride': 8, 'dropout': 0.3, 'fc_dropout': 0.2, 'attn_dropout': 0.1, 'revin': False, 'input_size': 72, 'learning_rate': 0.0007260599288806133, 'scaler_type': 'standard', 'model_step_size': 12}. Best is trial 14 with value: 47.868384326726456.
Seed set to 1
GPU available: True (cuda), used: True
TPU available: False, using: 0 TPU cores
HPU available: False, using: 0 HPUs
LOCAL_RANK: 0 - CUDA_VISIBLE_DEVICES: [0]

  | Name         | Type              | Params | Mode
-----------------------------------------------------------
0 | loss         | MSE               | 0      | train
1 | valid_loss   | MSE               | 0      | train
2 | padder_train | ConstantPad1d     | 0      | train
3 | scaler       | TemporalNorm      | 0      | train
4 | model        | PatchTST_backbone | 1.0 M  | train
-----------------------------------------------------------
1.0 M     Trainable params
3         Non-trainable params
1.0 M     Total params
4.063     Total estimated model params size (MB)
90        Modules in train mode
0         Modules in eval mode
`Trainer.fit` stopped: `max_steps=1000` reached.
Trainer already configured with model summary callbacks: [<class 'pytorch_lightning.callbacks.model_summary.ModelSummary'>]. Skipping setting a default `ModelSummary` callback.
GPU available: True (cuda), used: True
TPU available: False, using: 0 TPU cores
HPU available: False, using: 0 HPUs
LOCAL_RANK: 0 - CUDA_VISIBLE_DEVICES: [0]
Seed set to 1
GPU available: True (cuda), used: True
TPU available: False, using: 0 TPU cores
HPU available: False, using: 0 HPUs
LOCAL_RANK: 0 - CUDA_VISIBLE_DEVICES: [0]

  | Name         | Type              | Params | Mode
-----------------------------------------------------------
0 | loss         | MSE               | 0      | train
1 | valid_loss   | MSE               | 0      | train
2 | padder_train | ConstantPad1d     | 0      | train
3 | scaler       | TemporalNorm      | 0      | train
4 | model        | PatchTST_backbone | 1.0 M  | train
-----------------------------------------------------------
1.0 M     Trainable params
3         Non-trainable params
1.0 M     Total params
4.063     Total estimated model params size (MB)
90        Modules in train mode
0         Modules in eval mode
`Trainer.fit` stopped: `max_steps=1000` reached.
Trainer already configured with model summary callbacks: [<class 'pytorch_lightning.callbacks.model_summary.ModelSummary'>]. Skipping setting a default `ModelSummary` callback.
GPU available: True (cuda), used: True
TPU available: False, using: 0 TPU cores
HPU available: False, using: 0 HPUs
LOCAL_RANK: 0 - CUDA_VISIBLE_DEVICES: [0]
Seed set to 1
GPU available: True (cuda), used: True
TPU available: False, using: 0 TPU cores
HPU available: False, using: 0 HPUs
LOCAL_RANK: 0 - CUDA_VISIBLE_DEVICES: [0]

  | Name         | Type              | Params | Mode
-----------------------------------------------------------
0 | loss         | MSE               | 0      | train
1 | valid_loss   | MSE               | 0      | train
2 | padder_train | ConstantPad1d     | 0      | train
3 | scaler       | TemporalNorm      | 0      | train
4 | model        | PatchTST_backbone | 1.0 M  | train
-----------------------------------------------------------
1.0 M     Trainable params
3         Non-trainable params
1.0 M     Total params
4.063     Total estimated model params size (MB)
90        Modules in train mode
0         Modules in eval mode
`Trainer.fit` stopped: `max_steps=1000` reached.
Trainer already configured with model summary callbacks: [<class 'pytorch_lightning.callbacks.model_summary.ModelSummary'>]. Skipping setting a default `ModelSummary` callback.
GPU available: True (cuda), used: True
TPU available: False, using: 0 TPU cores
HPU available: False, using: 0 HPUs
LOCAL_RANK: 0 - CUDA_VISIBLE_DEVICES: [0]
Seed set to 1
GPU available: True (cuda), used: True
TPU available: False, using: 0 TPU cores
HPU available: False, using: 0 HPUs
LOCAL_RANK: 0 - CUDA_VISIBLE_DEVICES: [0]

  | Name         | Type              | Params | Mode
-----------------------------------------------------------
0 | loss         | MSE               | 0      | train
1 | valid_loss   | MSE               | 0      | train
2 | padder_train | ConstantPad1d     | 0      | train
3 | scaler       | TemporalNorm      | 0      | train
4 | model        | PatchTST_backbone | 1.0 M  | train
-----------------------------------------------------------
1.0 M     Trainable params
3         Non-trainable params
1.0 M     Total params
4.063     Total estimated model params size (MB)
90        Modules in train mode
0         Modules in eval mode
`Trainer.fit` stopped: `max_steps=1000` reached.
Trainer already configured with model summary callbacks: [<class 'pytorch_lightning.callbacks.model_summary.ModelSummary'>]. Skipping setting a default `ModelSummary` callback.
GPU available: True (cuda), used: True
TPU available: False, using: 0 TPU cores
HPU available: False, using: 0 HPUs
LOCAL_RANK: 0 - CUDA_VISIBLE_DEVICES: [0]
Seed set to 1
GPU available: True (cuda), used: True
TPU available: False, using: 0 TPU cores
HPU available: False, using: 0 HPUs
LOCAL_RANK: 0 - CUDA_VISIBLE_DEVICES: [0]

  | Name         | Type              | Params | Mode
-----------------------------------------------------------
0 | loss         | MSE               | 0      | train
1 | valid_loss   | MSE               | 0      | train
2 | padder_train | ConstantPad1d     | 0      | train
3 | scaler       | TemporalNorm      | 0      | train
4 | model        | PatchTST_backbone | 1.0 M  | train
-----------------------------------------------------------
1.0 M     Trainable params
3         Non-trainable params
1.0 M     Total params
4.063     Total estimated model params size (MB)
90        Modules in train mode
0         Modules in eval mode
`Trainer.fit` stopped: `max_steps=1000` reached.
Trainer already configured with model summary callbacks: [<class 'pytorch_lightning.callbacks.model_summary.ModelSummary'>]. Skipping setting a default `ModelSummary` callback.
GPU available: True (cuda), used: True
TPU available: False, using: 0 TPU cores
HPU available: False, using: 0 HPUs
LOCAL_RANK: 0 - CUDA_VISIBLE_DEVICES: [0]
[I 2026-03-22 00:21:59,624] Trial 22 finished with value: 51.771638952361116 and parameters: {'hidden_size': 256, 'n_heads': 8, 'encoder_layers': 3, 'linear_hidden_size': 128, 'patch_len': 8, 'stride': 8, 'dropout': 0.3, 'fc_dropout': 0.2, 'attn_dropout': 0.1, 'revin': False, 'input_size': 72, 'learning_rate': 0.001025252372767165, 'scaler_type': 'standard', 'model_step_size': 12}. Best is trial 14 with value: 47.868384326726456.
Seed set to 1
GPU available: True (cuda), used: True
TPU available: False, using: 0 TPU cores
HPU available: False, using: 0 HPUs
LOCAL_RANK: 0 - CUDA_VISIBLE_DEVICES: [0]

  | Name         | Type              | Params | Mode
-----------------------------------------------------------
0 | loss         | MSE               | 0      | train
1 | valid_loss   | MSE               | 0      | train
2 | padder_train | ConstantPad1d     | 0      | train
3 | scaler       | TemporalNorm      | 0      | train
4 | model        | PatchTST_backbone | 1.0 M  | train
-----------------------------------------------------------
1.0 M     Trainable params
3         Non-trainable params
1.0 M     Total params
4.059     Total estimated model params size (MB)
90        Modules in train mode
0         Modules in eval mode
`Trainer.fit` stopped: `max_steps=1000` reached.
Trainer already configured with model summary callbacks: [<class 'pytorch_lightning.callbacks.model_summary.ModelSummary'>]. Skipping setting a default `ModelSummary` callback.
GPU available: True (cuda), used: True
TPU available: False, using: 0 TPU cores
HPU available: False, using: 0 HPUs
LOCAL_RANK: 0 - CUDA_VISIBLE_DEVICES: [0]
Seed set to 1
GPU available: True (cuda), used: True
TPU available: False, using: 0 TPU cores
HPU available: False, using: 0 HPUs
LOCAL_RANK: 0 - CUDA_VISIBLE_DEVICES: [0]

  | Name         | Type              | Params | Mode
-----------------------------------------------------------
0 | loss         | MSE               | 0      | train
1 | valid_loss   | MSE               | 0      | train
2 | padder_train | ConstantPad1d     | 0      | train
3 | scaler       | TemporalNorm      | 0      | train
4 | model        | PatchTST_backbone | 1.0 M  | train
-----------------------------------------------------------
1.0 M     Trainable params
3         Non-trainable params
1.0 M     Total params
4.059     Total estimated model params size (MB)
90        Modules in train mode
0         Modules in eval mode
`Trainer.fit` stopped: `max_steps=1000` reached.
Trainer already configured with model summary callbacks: [<class 'pytorch_lightning.callbacks.model_summary.ModelSummary'>]. Skipping setting a default `ModelSummary` callback.
GPU available: True (cuda), used: True
TPU available: False, using: 0 TPU cores
HPU available: False, using: 0 HPUs
LOCAL_RANK: 0 - CUDA_VISIBLE_DEVICES: [0]
Seed set to 1
GPU available: True (cuda), used: True
TPU available: False, using: 0 TPU cores
HPU available: False, using: 0 HPUs
LOCAL_RANK: 0 - CUDA_VISIBLE_DEVICES: [0]

  | Name         | Type              | Params | Mode
-----------------------------------------------------------
0 | loss         | MSE               | 0      | train
1 | valid_loss   | MSE               | 0      | train
2 | padder_train | ConstantPad1d     | 0      | train
3 | scaler       | TemporalNorm      | 0      | train
4 | model        | PatchTST_backbone | 1.0 M  | train
-----------------------------------------------------------
1.0 M     Trainable params
3         Non-trainable params
1.0 M     Total params
4.059     Total estimated model params size (MB)
90        Modules in train mode
0         Modules in eval mode
`Trainer.fit` stopped: `max_steps=1000` reached.
Trainer already configured with model summary callbacks: [<class 'pytorch_lightning.callbacks.model_summary.ModelSummary'>]. Skipping setting a default `ModelSummary` callback.
GPU available: True (cuda), used: True
TPU available: False, using: 0 TPU cores
HPU available: False, using: 0 HPUs
LOCAL_RANK: 0 - CUDA_VISIBLE_DEVICES: [0]
Seed set to 1
GPU available: True (cuda), used: True
TPU available: False, using: 0 TPU cores
HPU available: False, using: 0 HPUs
LOCAL_RANK: 0 - CUDA_VISIBLE_DEVICES: [0]

  | Name         | Type              | Params | Mode
-----------------------------------------------------------
0 | loss         | MSE               | 0      | train
1 | valid_loss   | MSE               | 0      | train
2 | padder_train | ConstantPad1d     | 0      | train
3 | scaler       | TemporalNorm      | 0      | train
4 | model        | PatchTST_backbone | 1.0 M  | train
-----------------------------------------------------------
1.0 M     Trainable params
3         Non-trainable params
1.0 M     Total params
4.059     Total estimated model params size (MB)
90        Modules in train mode
0         Modules in eval mode
`Trainer.fit` stopped: `max_steps=1000` reached.
Trainer already configured with model summary callbacks: [<class 'pytorch_lightning.callbacks.model_summary.ModelSummary'>]. Skipping setting a default `ModelSummary` callback.
GPU available: True (cuda), used: True
TPU available: False, using: 0 TPU cores
HPU available: False, using: 0 HPUs
LOCAL_RANK: 0 - CUDA_VISIBLE_DEVICES: [0]
Seed set to 1
GPU available: True (cuda), used: True
TPU available: False, using: 0 TPU cores
HPU available: False, using: 0 HPUs
LOCAL_RANK: 0 - CUDA_VISIBLE_DEVICES: [0]

  | Name         | Type              | Params | Mode
-----------------------------------------------------------
0 | loss         | MSE               | 0      | train
1 | valid_loss   | MSE               | 0      | train
2 | padder_train | ConstantPad1d     | 0      | train
3 | scaler       | TemporalNorm      | 0      | train
4 | model        | PatchTST_backbone | 1.0 M  | train
-----------------------------------------------------------
1.0 M     Trainable params
3         Non-trainable params
1.0 M     Total params
4.059     Total estimated model params size (MB)
90        Modules in train mode
0         Modules in eval mode
`Trainer.fit` stopped: `max_steps=1000` reached.
Trainer already configured with model summary callbacks: [<class 'pytorch_lightning.callbacks.model_summary.ModelSummary'>]. Skipping setting a default `ModelSummary` callback.
GPU available: True (cuda), used: True
TPU available: False, using: 0 TPU cores
HPU available: False, using: 0 HPUs
LOCAL_RANK: 0 - CUDA_VISIBLE_DEVICES: [0]
