[I 2026-03-22 09:57:47,616] Trial 170 finished with value: 48.60539182575007 and parameters: {'hidden_size': 64, 'n_heads': 4, 'encoder_layers': 4, 'linear_hidden_size': 512, 'patch_len': 16, 'stride': 8, 'dropout': 0.1, 'fc_dropout': 0.2, 'attn_dropout': 0.1, 'revin': True, 'input_size': 96, 'learning_rate': 0.003326205896602994, 'scaler_type': 'robust', 'model_step_size': 12}. Best is trial 135 with value: 36.960917115012194.
Seed set to 1
GPU available: True (cuda), used: True
TPU available: False, using: 0 TPU cores
HPU available: False, using: 0 HPUs
LOCAL_RANK: 0 - CUDA_VISIBLE_DEVICES: [0]

  | Name         | Type              | Params | Mode
-----------------------------------------------------------
0 | loss         | MSE               | 0      | train
1 | valid_loss   | MSE               | 0      | train
2 | padder_train | ConstantPad1d     | 0      | train
3 | scaler       | TemporalNorm      | 0      | train
4 | model        | PatchTST_backbone | 340 K  | train
-----------------------------------------------------------
340 K     Trainable params
4         Non-trainable params
340 K     Total params
1.360     Total estimated model params size (MB)
116       Modules in train mode
0         Modules in eval mode
`Trainer.fit` stopped: `max_steps=1000` reached.
Trainer already configured with model summary callbacks: [<class 'pytorch_lightning.callbacks.model_summary.ModelSummary'>]. Skipping setting a default `ModelSummary` callback.
GPU available: True (cuda), used: True
TPU available: False, using: 0 TPU cores
HPU available: False, using: 0 HPUs
LOCAL_RANK: 0 - CUDA_VISIBLE_DEVICES: [0]
Seed set to 1
GPU available: True (cuda), used: True
TPU available: False, using: 0 TPU cores
HPU available: False, using: 0 HPUs
LOCAL_RANK: 0 - CUDA_VISIBLE_DEVICES: [0]

  | Name         | Type              | Params | Mode
-----------------------------------------------------------
0 | loss         | MSE               | 0      | train
1 | valid_loss   | MSE               | 0      | train
2 | padder_train | ConstantPad1d     | 0      | train
3 | scaler       | TemporalNorm      | 0      | train
4 | model        | PatchTST_backbone | 340 K  | train
-----------------------------------------------------------
340 K     Trainable params
4         Non-trainable params
340 K     Total params
1.360     Total estimated model params size (MB)
116       Modules in train mode
0         Modules in eval mode
`Trainer.fit` stopped: `max_steps=1000` reached.
Trainer already configured with model summary callbacks: [<class 'pytorch_lightning.callbacks.model_summary.ModelSummary'>]. Skipping setting a default `ModelSummary` callback.
GPU available: True (cuda), used: True
TPU available: False, using: 0 TPU cores
HPU available: False, using: 0 HPUs
LOCAL_RANK: 0 - CUDA_VISIBLE_DEVICES: [0]
Seed set to 1
GPU available: True (cuda), used: True
TPU available: False, using: 0 TPU cores
HPU available: False, using: 0 HPUs
LOCAL_RANK: 0 - CUDA_VISIBLE_DEVICES: [0]

  | Name         | Type              | Params | Mode
-----------------------------------------------------------
0 | loss         | MSE               | 0      | train
1 | valid_loss   | MSE               | 0      | train
2 | padder_train | ConstantPad1d     | 0      | train
3 | scaler       | TemporalNorm      | 0      | train
4 | model        | PatchTST_backbone | 340 K  | train
-----------------------------------------------------------
340 K     Trainable params
4         Non-trainable params
340 K     Total params
1.360     Total estimated model params size (MB)
116       Modules in train mode
0         Modules in eval mode
`Trainer.fit` stopped: `max_steps=1000` reached.
Trainer already configured with model summary callbacks: [<class 'pytorch_lightning.callbacks.model_summary.ModelSummary'>]. Skipping setting a default `ModelSummary` callback.
GPU available: True (cuda), used: True
TPU available: False, using: 0 TPU cores
HPU available: False, using: 0 HPUs
LOCAL_RANK: 0 - CUDA_VISIBLE_DEVICES: [0]
Seed set to 1
GPU available: True (cuda), used: True
TPU available: False, using: 0 TPU cores
HPU available: False, using: 0 HPUs
LOCAL_RANK: 0 - CUDA_VISIBLE_DEVICES: [0]

  | Name         | Type              | Params | Mode
-----------------------------------------------------------
0 | loss         | MSE               | 0      | train
1 | valid_loss   | MSE               | 0      | train
2 | padder_train | ConstantPad1d     | 0      | train
3 | scaler       | TemporalNorm      | 0      | train
4 | model        | PatchTST_backbone | 340 K  | train
-----------------------------------------------------------
340 K     Trainable params
4         Non-trainable params
340 K     Total params
1.360     Total estimated model params size (MB)
116       Modules in train mode
0         Modules in eval mode
`Trainer.fit` stopped: `max_steps=1000` reached.
Trainer already configured with model summary callbacks: [<class 'pytorch_lightning.callbacks.model_summary.ModelSummary'>]. Skipping setting a default `ModelSummary` callback.
GPU available: True (cuda), used: True
TPU available: False, using: 0 TPU cores
HPU available: False, using: 0 HPUs
LOCAL_RANK: 0 - CUDA_VISIBLE_DEVICES: [0]
Seed set to 1
GPU available: True (cuda), used: True
TPU available: False, using: 0 TPU cores
HPU available: False, using: 0 HPUs
LOCAL_RANK: 0 - CUDA_VISIBLE_DEVICES: [0]

  | Name         | Type              | Params | Mode
-----------------------------------------------------------
0 | loss         | MSE               | 0      | train
1 | valid_loss   | MSE               | 0      | train
2 | padder_train | ConstantPad1d     | 0      | train
3 | scaler       | TemporalNorm      | 0      | train
4 | model        | PatchTST_backbone | 340 K  | train
-----------------------------------------------------------
340 K     Trainable params
4         Non-trainable params
340 K     Total params
1.360     Total estimated model params size (MB)
116       Modules in train mode
0         Modules in eval mode
`Trainer.fit` stopped: `max_steps=1000` reached.
Trainer already configured with model summary callbacks: [<class 'pytorch_lightning.callbacks.model_summary.ModelSummary'>]. Skipping setting a default `ModelSummary` callback.
GPU available: True (cuda), used: True
TPU available: False, using: 0 TPU cores
HPU available: False, using: 0 HPUs
LOCAL_RANK: 0 - CUDA_VISIBLE_DEVICES: [0]
[I 2026-03-22 10:00:08,083] Trial 171 finished with value: 40.27303480489635 and parameters: {'hidden_size': 64, 'n_heads': 4, 'encoder_layers': 4, 'linear_hidden_size': 512, 'patch_len': 16, 'stride': 8, 'dropout': 0.1, 'fc_dropout': 0.2, 'attn_dropout': 0.1, 'revin': True, 'input_size': 96, 'learning_rate': 0.002995438729149255, 'scaler_type': 'identity', 'model_step_size': 1}. Best is trial 135 with value: 36.960917115012194.
Seed set to 1
GPU available: True (cuda), used: True
TPU available: False, using: 0 TPU cores
HPU available: False, using: 0 HPUs
LOCAL_RANK: 0 - CUDA_VISIBLE_DEVICES: [0]

  | Name         | Type              | Params | Mode
-----------------------------------------------------------
0 | loss         | MSE               | 0      | train
1 | valid_loss   | MSE               | 0      | train
2 | padder_train | ConstantPad1d     | 0      | train
3 | scaler       | TemporalNorm      | 0      | train
4 | model        | PatchTST_backbone | 340 K  | train
-----------------------------------------------------------
340 K     Trainable params
4         Non-trainable params
340 K     Total params
1.360     Total estimated model params size (MB)
116       Modules in train mode
0         Modules in eval mode
`Trainer.fit` stopped: `max_steps=1000` reached.
Trainer already configured with model summary callbacks: [<class 'pytorch_lightning.callbacks.model_summary.ModelSummary'>]. Skipping setting a default `ModelSummary` callback.
GPU available: True (cuda), used: True
TPU available: False, using: 0 TPU cores
HPU available: False, using: 0 HPUs
LOCAL_RANK: 0 - CUDA_VISIBLE_DEVICES: [0]
Seed set to 1
GPU available: True (cuda), used: True
TPU available: False, using: 0 TPU cores
HPU available: False, using: 0 HPUs
LOCAL_RANK: 0 - CUDA_VISIBLE_DEVICES: [0]

  | Name         | Type              | Params | Mode
-----------------------------------------------------------
0 | loss         | MSE               | 0      | train
1 | valid_loss   | MSE               | 0      | train
2 | padder_train | ConstantPad1d     | 0      | train
3 | scaler       | TemporalNorm      | 0      | train
4 | model        | PatchTST_backbone | 340 K  | train
-----------------------------------------------------------
340 K     Trainable params
4         Non-trainable params
340 K     Total params
1.360     Total estimated model params size (MB)
116       Modules in train mode
0         Modules in eval mode
`Trainer.fit` stopped: `max_steps=1000` reached.
Trainer already configured with model summary callbacks: [<class 'pytorch_lightning.callbacks.model_summary.ModelSummary'>]. Skipping setting a default `ModelSummary` callback.
GPU available: True (cuda), used: True
TPU available: False, using: 0 TPU cores
HPU available: False, using: 0 HPUs
LOCAL_RANK: 0 - CUDA_VISIBLE_DEVICES: [0]
Seed set to 1
GPU available: True (cuda), used: True
TPU available: False, using: 0 TPU cores
HPU available: False, using: 0 HPUs
LOCAL_RANK: 0 - CUDA_VISIBLE_DEVICES: [0]

  | Name         | Type              | Params | Mode
-----------------------------------------------------------
0 | loss         | MSE               | 0      | train
1 | valid_loss   | MSE               | 0      | train
2 | padder_train | ConstantPad1d     | 0      | train
3 | scaler       | TemporalNorm      | 0      | train
4 | model        | PatchTST_backbone | 340 K  | train
-----------------------------------------------------------
340 K     Trainable params
4         Non-trainable params
340 K     Total params
1.360     Total estimated model params size (MB)
116       Modules in train mode
0         Modules in eval mode
`Trainer.fit` stopped: `max_steps=1000` reached.
Trainer already configured with model summary callbacks: [<class 'pytorch_lightning.callbacks.model_summary.ModelSummary'>]. Skipping setting a default `ModelSummary` callback.
GPU available: True (cuda), used: True
TPU available: False, using: 0 TPU cores
HPU available: False, using: 0 HPUs
LOCAL_RANK: 0 - CUDA_VISIBLE_DEVICES: [0]
Seed set to 1
GPU available: True (cuda), used: True
TPU available: False, using: 0 TPU cores
HPU available: False, using: 0 HPUs
LOCAL_RANK: 0 - CUDA_VISIBLE_DEVICES: [0]

  | Name         | Type              | Params | Mode
-----------------------------------------------------------
0 | loss         | MSE               | 0      | train
1 | valid_loss   | MSE               | 0      | train
2 | padder_train | ConstantPad1d     | 0      | train
3 | scaler       | TemporalNorm      | 0      | train
4 | model        | PatchTST_backbone | 340 K  | train
-----------------------------------------------------------
340 K     Trainable params
4         Non-trainable params
340 K     Total params
1.360     Total estimated model params size (MB)
116       Modules in train mode
0         Modules in eval mode
`Trainer.fit` stopped: `max_steps=1000` reached.
Trainer already configured with model summary callbacks: [<class 'pytorch_lightning.callbacks.model_summary.ModelSummary'>]. Skipping setting a default `ModelSummary` callback.
GPU available: True (cuda), used: True
TPU available: False, using: 0 TPU cores
HPU available: False, using: 0 HPUs
LOCAL_RANK: 0 - CUDA_VISIBLE_DEVICES: [0]
Seed set to 1
GPU available: True (cuda), used: True
TPU available: False, using: 0 TPU cores
HPU available: False, using: 0 HPUs
LOCAL_RANK: 0 - CUDA_VISIBLE_DEVICES: [0]

  | Name         | Type              | Params | Mode
-----------------------------------------------------------
0 | loss         | MSE               | 0      | train
1 | valid_loss   | MSE               | 0      | train
2 | padder_train | ConstantPad1d     | 0      | train
3 | scaler       | TemporalNorm      | 0      | train
4 | model        | PatchTST_backbone | 340 K  | train
-----------------------------------------------------------
340 K     Trainable params
4         Non-trainable params
340 K     Total params
1.360     Total estimated model params size (MB)
116       Modules in train mode
0         Modules in eval mode
`Trainer.fit` stopped: `max_steps=1000` reached.
Trainer already configured with model summary callbacks: [<class 'pytorch_lightning.callbacks.model_summary.ModelSummary'>]. Skipping setting a default `ModelSummary` callback.
GPU available: True (cuda), used: True
TPU available: False, using: 0 TPU cores
HPU available: False, using: 0 HPUs
LOCAL_RANK: 0 - CUDA_VISIBLE_DEVICES: [0]
[I 2026-03-22 10:02:36,097] Trial 172 finished with value: 39.85622110545721 and parameters: {'hidden_size': 64, 'n_heads': 4, 'encoder_layers': 4, 'linear_hidden_size': 512, 'patch_len': 16, 'stride': 8, 'dropout': 0.1, 'fc_dropout': 0.2, 'attn_dropout': 0.1, 'revin': True, 'input_size': 96, 'learning_rate': 0.0030697012472614338, 'scaler_type': 'identity', 'model_step_size': 1}. Best is trial 135 with value: 36.960917115012194.
Seed set to 1
GPU available: True (cuda), used: True
TPU available: False, using: 0 TPU cores
HPU available: False, using: 0 HPUs
LOCAL_RANK: 0 - CUDA_VISIBLE_DEVICES: [0]

  | Name         | Type              | Params | Mode
-----------------------------------------------------------
0 | loss         | MSE               | 0      | train
1 | valid_loss   | MSE               | 0      | train
2 | padder_train | ConstantPad1d     | 0      | train
3 | scaler       | TemporalNorm      | 0      | train
4 | model        | PatchTST_backbone | 340 K  | train
-----------------------------------------------------------
340 K     Trainable params
4         Non-trainable params
340 K     Total params
1.360     Total estimated model params size (MB)
116       Modules in train mode
0         Modules in eval mode
`Trainer.fit` stopped: `max_steps=1000` reached.
Trainer already configured with model summary callbacks: [<class 'pytorch_lightning.callbacks.model_summary.ModelSummary'>]. Skipping setting a default `ModelSummary` callback.
GPU available: True (cuda), used: True
TPU available: False, using: 0 TPU cores
HPU available: False, using: 0 HPUs
LOCAL_RANK: 0 - CUDA_VISIBLE_DEVICES: [0]
Seed set to 1
GPU available: True (cuda), used: True
TPU available: False, using: 0 TPU cores
HPU available: False, using: 0 HPUs
LOCAL_RANK: 0 - CUDA_VISIBLE_DEVICES: [0]

  | Name         | Type              | Params | Mode
-----------------------------------------------------------
0 | loss         | MSE               | 0      | train
1 | valid_loss   | MSE               | 0      | train
2 | padder_train | ConstantPad1d     | 0      | train
3 | scaler       | TemporalNorm      | 0      | train
4 | model        | PatchTST_backbone | 340 K  | train
-----------------------------------------------------------
340 K     Trainable params
4         Non-trainable params
340 K     Total params
1.360     Total estimated model params size (MB)
116       Modules in train mode
0         Modules in eval mode
`Trainer.fit` stopped: `max_steps=1000` reached.
Trainer already configured with model summary callbacks: [<class 'pytorch_lightning.callbacks.model_summary.ModelSummary'>]. Skipping setting a default `ModelSummary` callback.
GPU available: True (cuda), used: True
TPU available: False, using: 0 TPU cores
HPU available: False, using: 0 HPUs
LOCAL_RANK: 0 - CUDA_VISIBLE_DEVICES: [0]
Seed set to 1
GPU available: True (cuda), used: True
TPU available: False, using: 0 TPU cores
HPU available: False, using: 0 HPUs
LOCAL_RANK: 0 - CUDA_VISIBLE_DEVICES: [0]

  | Name         | Type              | Params | Mode
-----------------------------------------------------------
0 | loss         | MSE               | 0      | train
1 | valid_loss   | MSE               | 0      | train
2 | padder_train | ConstantPad1d     | 0      | train
3 | scaler       | TemporalNorm      | 0      | train
4 | model        | PatchTST_backbone | 340 K  | train
-----------------------------------------------------------
340 K     Trainable params
4         Non-trainable params
340 K     Total params
1.360     Total estimated model params size (MB)
116       Modules in train mode
0         Modules in eval mode
`Trainer.fit` stopped: `max_steps=1000` reached.
Trainer already configured with model summary callbacks: [<class 'pytorch_lightning.callbacks.model_summary.ModelSummary'>]. Skipping setting a default `ModelSummary` callback.
GPU available: True (cuda), used: True
TPU available: False, using: 0 TPU cores
HPU available: False, using: 0 HPUs
LOCAL_RANK: 0 - CUDA_VISIBLE_DEVICES: [0]
Seed set to 1
GPU available: True (cuda), used: True
TPU available: False, using: 0 TPU cores
HPU available: False, using: 0 HPUs
LOCAL_RANK: 0 - CUDA_VISIBLE_DEVICES: [0]

  | Name         | Type              | Params | Mode
-----------------------------------------------------------
0 | loss         | MSE               | 0      | train
1 | valid_loss   | MSE               | 0      | train
2 | padder_train | ConstantPad1d     | 0      | train
3 | scaler       | TemporalNorm      | 0      | train
4 | model        | PatchTST_backbone | 340 K  | train
-----------------------------------------------------------
340 K     Trainable params
4         Non-trainable params
340 K     Total params
1.360     Total estimated model params size (MB)
116       Modules in train mode
0         Modules in eval mode
`Trainer.fit` stopped: `max_steps=1000` reached.
Trainer already configured with model summary callbacks: [<class 'pytorch_lightning.callbacks.model_summary.ModelSummary'>]. Skipping setting a default `ModelSummary` callback.
GPU available: True (cuda), used: True
TPU available: False, using: 0 TPU cores
HPU available: False, using: 0 HPUs
LOCAL_RANK: 0 - CUDA_VISIBLE_DEVICES: [0]
Seed set to 1
GPU available: True (cuda), used: True
TPU available: False, using: 0 TPU cores
HPU available: False, using: 0 HPUs
LOCAL_RANK: 0 - CUDA_VISIBLE_DEVICES: [0]

  | Name         | Type              | Params | Mode
-----------------------------------------------------------
0 | loss         | MSE               | 0      | train
1 | valid_loss   | MSE               | 0      | train
2 | padder_train | ConstantPad1d     | 0      | train
3 | scaler       | TemporalNorm      | 0      | train
4 | model        | PatchTST_backbone | 340 K  | train
-----------------------------------------------------------
340 K     Trainable params
4         Non-trainable params
340 K     Total params
1.360     Total estimated model params size (MB)
116       Modules in train mode
0         Modules in eval mode
`Trainer.fit` stopped: `max_steps=1000` reached.
Trainer already configured with model summary callbacks: [<class 'pytorch_lightning.callbacks.model_summary.ModelSummary'>]. Skipping setting a default `ModelSummary` callback.
GPU available: True (cuda), used: True
TPU available: False, using: 0 TPU cores
HPU available: False, using: 0 HPUs
LOCAL_RANK: 0 - CUDA_VISIBLE_DEVICES: [0]
