[I 2026-03-22 11:17:02,387] Trial 8 finished with value: 37.80434714948385 and parameters: {'n_estimators': 64, 'max_depth': 6, 'learning_rate': 0.028377096553967567, 'subsample': 0.9517009576439417, 'colsample_bytree': 0.5687373520731187}. Best is trial 6 with value: 37.63279454611763.
[I 2026-03-22 11:17:02,480] Trial 9 finished with value: 37.68915707246513 and parameters: {'n_estimators': 32, 'max_depth': 6, 'learning_rate': 0.007268724405433989, 'subsample': 0.8754060515680777, 'colsample_bytree': 0.8629989926752257}. Best is trial 6 with value: 37.63279454611763.
[I 2026-03-22 11:17:02,605] Trial 10 finished with value: 37.6537194377522 and parameters: {'n_estimators': 128, 'max_depth': 4, 'learning_rate': 0.001121994642314699, 'subsample': 0.7560893830486056, 'colsample_bytree': 0.5046406240009059}. Best is trial 6 with value: 37.63279454611763.
[I 2026-03-22 11:17:02,735] Trial 11 finished with value: 37.656736258248536 and parameters: {'n_estimators': 128, 'max_depth': 4, 'learning_rate': 0.001051239026143344, 'subsample': 0.7320972594642835, 'colsample_bytree': 0.5049929002994904}. Best is trial 6 with value: 37.63279454611763.
[I 2026-03-22 11:17:02,840] Trial 12 finished with value: 37.62967020790055 and parameters: {'n_estimators': 128, 'max_depth': 4, 'learning_rate': 0.0034198486647844784, 'subsample': 0.7538018602155415, 'colsample_bytree': 0.5392235608871075}. Best is trial 12 with value: 37.62967020790055.
[I 2026-03-22 11:17:02,947] Trial 13 finished with value: 37.64011551797697 and parameters: {'n_estimators': 128, 'max_depth': 3, 'learning_rate': 0.0036222413742347226, 'subsample': 0.7580181470176622, 'colsample_bytree': 0.5957781118486645}. Best is trial 12 with value: 37.62967020790055.
[I 2026-03-22 11:17:03,033] Trial 14 finished with value: 37.64015105100795 and parameters: {'n_estimators': 64, 'max_depth': 3, 'learning_rate': 0.0038181089118321083, 'subsample': 0.6784252716567445, 'colsample_bytree': 0.580253584436401}. Best is trial 12 with value: 37.62967020790055.
[I 2026-03-22 11:17:03,149] Trial 15 finished with value: 37.71455850982357 and parameters: {'n_estimators': 128, 'max_depth': 4, 'learning_rate': 0.03267025089848925, 'subsample': 0.8243339635401141, 'colsample_bytree': 0.9845212264211136}. Best is trial 12 with value: 37.62967020790055.
[I 2026-03-22 11:17:03,275] Trial 16 finished with value: 37.67273430108783 and parameters: {'n_estimators': 128, 'max_depth': 5, 'learning_rate': 0.0037270045588530423, 'subsample': 0.6878327285195385, 'colsample_bytree': 0.6207203509551775}. Best is trial 12 with value: 37.62967020790055.
[I 2026-03-22 11:17:03,386] Trial 17 finished with value: 37.64642307300658 and parameters: {'n_estimators': 128, 'max_depth': 3, 'learning_rate': 0.0023488880474828856, 'subsample': 0.8067582733331393, 'colsample_bytree': 0.7781751934202785}. Best is trial 12 with value: 37.62967020790055.
[I 2026-03-22 11:17:03,483] Trial 18 finished with value: 37.65735226326083 and parameters: {'n_estimators': 64, 'max_depth': 5, 'learning_rate': 0.00651805953973135, 'subsample': 0.6231722080043663, 'colsample_bytree': 0.5436659559492232}. Best is trial 12 with value: 37.62967020790055.
[I 2026-03-22 11:17:03,555] Trial 19 finished with value: 37.63971285354842 and parameters: {'n_estimators': 16, 'max_depth': 3, 'learning_rate': 0.02476848267366412, 'subsample': 0.881742316770407, 'colsample_bytree': 0.5462368781167534}. Best is trial 12 with value: 37.62967020790055.
[I 2026-03-22 11:17:03,674] Trial 20 finished with value: 37.83511026434532 and parameters: {'n_estimators': 128, 'max_depth': 4, 'learning_rate': 0.05663909527281229, 'subsample': 0.7168228190639454, 'colsample_bytree': 0.9708467237811416}. Best is trial 12 with value: 37.62967020790055.
[I 2026-03-22 11:17:03,752] Trial 21 finished with value: 37.6477725076559 and parameters: {'n_estimators': 16, 'max_depth': 3, 'learning_rate': 0.021417621976560296, 'subsample': 0.9136336497613825, 'colsample_bytree': 0.5343596672683046}. Best is trial 12 with value: 37.62967020790055.
[I 2026-03-22 11:17:03,818] Trial 22 finished with value: 37.65143397033196 and parameters: {'n_estimators': 16, 'max_depth': 3, 'learning_rate': 0.05418744526067906, 'subsample': 0.7982281453375811, 'colsample_bytree': 0.6127679999474133}. Best is trial 12 with value: 37.62967020790055.
[I 2026-03-22 11:17:03,910] Trial 23 finished with value: 37.66335100049464 and parameters: {'n_estimators': 16, 'max_depth': 4, 'learning_rate': 0.006227095628170642, 'subsample': 0.9884787308543654, 'colsample_bytree': 0.5553944770300344}. Best is trial 12 with value: 37.62967020790055.
[I 2026-03-22 11:17:03,981] Trial 24 finished with value: 37.65266546001105 and parameters: {'n_estimators': 16, 'max_depth': 3, 'learning_rate': 0.014395099243381324, 'subsample': 0.8615444332822624, 'colsample_bytree': 0.5000293055184682}. Best is trial 12 with value: 37.62967020790055.
[I 2026-03-22 11:17:04,096] Trial 25 finished with value: 37.63247358351593 and parameters: {'n_estimators': 128, 'max_depth': 4, 'learning_rate': 0.002524919029738651, 'subsample': 0.7831768458798268, 'colsample_bytree': 0.6680794807594436}. Best is trial 12 with value: 37.62967020790055.
[I 2026-03-22 11:17:04,219] Trial 26 finished with value: 37.65720982566614 and parameters: {'n_estimators': 128, 'max_depth': 5, 'learning_rate': 0.0023998060156256848, 'subsample': 0.7706155205780966, 'colsample_bytree': 0.7527963160712801}. Best is trial 12 with value: 37.62967020790055.
[I 2026-03-22 11:17:04,331] Trial 27 finished with value: 37.65272710717229 and parameters: {'n_estimators': 128, 'max_depth': 4, 'learning_rate': 0.0016145000428025454, 'subsample': 0.7029385536529934, 'colsample_bytree': 0.6732682056744033}. Best is trial 12 with value: 37.62967020790055.
[I 2026-03-22 11:17:04,436] Trial 28 finished with value: 37.60803587762052 and parameters: {'n_estimators': 128, 'max_depth': 4, 'learning_rate': 0.0049771272374551315, 'subsample': 0.7909766444931554, 'colsample_bytree': 0.6365140950644743}. Best is trial 28 with value: 37.60803587762052.
[I 2026-03-22 11:17:04,553] Trial 29 finished with value: 37.65431280352961 and parameters: {'n_estimators': 128, 'max_depth': 5, 'learning_rate': 0.0021048778537260844, 'subsample': 0.7864395108761305, 'colsample_bytree': 0.6648960902481447}. Best is trial 28 with value: 37.60803587762052.
[I 2026-03-22 11:17:04,666] Trial 30 finished with value: 37.60558540132959 and parameters: {'n_estimators': 128, 'max_depth': 4, 'learning_rate': 0.008174703722437017, 'subsample': 0.8273328879891855, 'colsample_bytree': 0.7111728164809251}. Best is trial 30 with value: 37.60558540132959.
[I 2026-03-22 11:17:04,783] Trial 31 finished with value: 37.60720100226471 and parameters: {'n_estimators': 128, 'max_depth': 4, 'learning_rate': 0.009236978993575277, 'subsample': 0.8309326063310384, 'colsample_bytree': 0.7082046264115738}. Best is trial 30 with value: 37.60558540132959.
[I 2026-03-22 11:17:04,893] Trial 32 finished with value: 37.60457114174602 and parameters: {'n_estimators': 128, 'max_depth': 4, 'learning_rate': 0.009204766217951571, 'subsample': 0.8315875964566563, 'colsample_bytree': 0.7905030872913925}. Best is trial 32 with value: 37.60457114174602.
[I 2026-03-22 11:17:05,012] Trial 33 finished with value: 37.60469504864767 and parameters: {'n_estimators': 128, 'max_depth': 4, 'learning_rate': 0.009218472075642942, 'subsample': 0.8293038320861295, 'colsample_bytree': 0.7906029101728201}. Best is trial 32 with value: 37.60457114174602.
[I 2026-03-22 11:17:05,099] Trial 34 finished with value: 37.66404151281888 and parameters: {'n_estimators': 32, 'max_depth': 5, 'learning_rate': 0.008806161679000647, 'subsample': 0.90048617219565, 'colsample_bytree': 0.7855541832684932}. Best is trial 32 with value: 37.60457114174602.
[I 2026-03-22 11:17:05,214] Trial 35 finished with value: 37.61884053319061 and parameters: {'n_estimators': 128, 'max_depth': 4, 'learning_rate': 0.019349604912252648, 'subsample': 0.8318700681668348, 'colsample_bytree': 0.8147447921698747}. Best is trial 32 with value: 37.60457114174602.
[I 2026-03-22 11:17:05,283] Trial 36 finished with value: 37.665495852981614 and parameters: {'n_estimators': 32, 'max_depth': 5, 'learning_rate': 0.01042335632544068, 'subsample': 0.9044623209584983, 'colsample_bytree': 0.7162504054530101}. Best is trial 32 with value: 37.60457114174602.
[I 2026-03-22 11:17:05,398] Trial 37 finished with value: 37.61211919858063 and parameters: {'n_estimators': 128, 'max_depth': 4, 'learning_rate': 0.014018955586843554, 'subsample': 0.8282899955740611, 'colsample_bytree': 0.9027991395845552}. Best is trial 32 with value: 37.60457114174602.
[I 2026-03-22 11:17:05,493] Trial 38 finished with value: 37.61498248629418 and parameters: {'n_estimators': 64, 'max_depth': 5, 'learning_rate': 0.008797017461291502, 'subsample': 0.9384465868980829, 'colsample_bytree': 0.7392230624849235}. Best is trial 32 with value: 37.60457114174602.
[I 2026-03-22 11:17:05,607] Trial 39 finished with value: 37.74006680130375 and parameters: {'n_estimators': 128, 'max_depth': 4, 'learning_rate': 0.042302797694412995, 'subsample': 0.8477867881271502, 'colsample_bytree': 0.799507923140971}. Best is trial 32 with value: 37.60457114174602.
[I 2026-03-22 11:17:05,739] Trial 40 finished with value: 38.17281232767799 and parameters: {'n_estimators': 128, 'max_depth': 5, 'learning_rate': 0.29206334339903517, 'subsample': 0.815402823649122, 'colsample_bytree': 0.8281629539828171}. Best is trial 32 with value: 37.60457114174602.
[I 2026-03-22 11:17:05,855] Trial 41 finished with value: 37.616352617379754 and parameters: {'n_estimators': 128, 'max_depth': 4, 'learning_rate': 0.005198094628257026, 'subsample': 0.8604419317175722, 'colsample_bytree': 0.7417069817413017}. Best is trial 32 with value: 37.60457114174602.
[I 2026-03-22 11:17:05,980] Trial 42 finished with value: 37.60282420514195 and parameters: {'n_estimators': 128, 'max_depth': 4, 'learning_rate': 0.005268811563339478, 'subsample': 0.8767707159554899, 'colsample_bytree': 0.6999833332357676}. Best is trial 42 with value: 37.60282420514195.
[I 2026-03-22 11:17:06,093] Trial 43 finished with value: 37.587821294369235 and parameters: {'n_estimators': 128, 'max_depth': 4, 'learning_rate': 0.011827640894408192, 'subsample': 0.8831472626622846, 'colsample_bytree': 0.6980518052548562}. Best is trial 43 with value: 37.587821294369235.
[I 2026-03-22 11:17:06,206] Trial 44 finished with value: 37.59135278569882 and parameters: {'n_estimators': 128, 'max_depth': 4, 'learning_rate': 0.012560173373730553, 'subsample': 0.9289553429055664, 'colsample_bytree': 0.6888424943022227}. Best is trial 43 with value: 37.587821294369235.
[I 2026-03-22 11:17:06,288] Trial 45 finished with value: 37.636954436227924 and parameters: {'n_estimators': 32, 'max_depth': 4, 'learning_rate': 0.013270264378514593, 'subsample': 0.9879369060986556, 'colsample_bytree': 0.767506088761579}. Best is trial 43 with value: 37.587821294369235.
[I 2026-03-22 11:17:06,408] Trial 46 finished with value: 37.60234557638606 and parameters: {'n_estimators': 128, 'max_depth': 4, 'learning_rate': 0.006146959053432244, 'subsample': 0.9179625945242114, 'colsample_bytree': 0.6882383254228278}. Best is trial 43 with value: 37.587821294369235.
[I 2026-03-22 11:17:06,518] Trial 47 finished with value: 37.61314304234769 and parameters: {'n_estimators': 128, 'max_depth': 3, 'learning_rate': 0.0174469968383738, 'subsample': 0.9346555638947462, 'colsample_bytree': 0.6898795561072635}. Best is trial 43 with value: 37.587821294369235.
[I 2026-03-22 11:17:06,608] Trial 48 finished with value: 37.59582165185661 and parameters: {'n_estimators': 64, 'max_depth': 4, 'learning_rate': 0.005644296780330614, 'subsample': 0.9667452824708044, 'colsample_bytree': 0.643331265978667}. Best is trial 43 with value: 37.587821294369235.
[I 2026-03-22 11:17:06,710] Trial 49 finished with value: 37.628096522689006 and parameters: {'n_estimators': 64, 'max_depth': 5, 'learning_rate': 0.0043898691038092045, 'subsample': 0.9709230082344965, 'colsample_bytree': 0.6531974530978437}. Best is trial 43 with value: 37.587821294369235.
[I 2026-03-22 11:17:06,795] Trial 50 finished with value: 37.63803371209592 and parameters: {'n_estimators': 64, 'max_depth': 2, 'learning_rate': 0.006648697790662762, 'subsample': 0.9605089747027843, 'colsample_bytree': 0.690150207830649}. Best is trial 43 with value: 37.587821294369235.
[I 2026-03-22 11:17:06,888] Trial 51 finished with value: 37.59476413767861 and parameters: {'n_estimators': 64, 'max_depth': 4, 'learning_rate': 0.006022675660437956, 'subsample': 0.9286675263702479, 'colsample_bytree': 0.7282345365773274}. Best is trial 43 with value: 37.587821294369235.
[I 2026-03-22 11:17:06,974] Trial 52 finished with value: 37.625420442170096 and parameters: {'n_estimators': 64, 'max_depth': 4, 'learning_rate': 0.0031978944467558894, 'subsample': 0.9216548229886338, 'colsample_bytree': 0.7309640336540193}. Best is trial 43 with value: 37.587821294369235.
[I 2026-03-22 11:17:07,062] Trial 53 finished with value: 37.591544770323495 and parameters: {'n_estimators': 64, 'max_depth': 4, 'learning_rate': 0.005810483250317541, 'subsample': 0.8846228494401602, 'colsample_bytree': 0.6897595196689646}. Best is trial 43 with value: 37.587821294369235.
[I 2026-03-22 11:17:07,148] Trial 54 finished with value: 37.621419093843215 and parameters: {'n_estimators': 64, 'max_depth': 3, 'learning_rate': 0.011433615803450582, 'subsample': 0.5411011510970913, 'colsample_bytree': 0.6348160440485495}. Best is trial 43 with value: 37.587821294369235.
[I 2026-03-22 11:17:07,233] Trial 55 finished with value: 37.59373456618029 and parameters: {'n_estimators': 64, 'max_depth': 4, 'learning_rate': 0.006164780627259803, 'subsample': 0.9329635598478113, 'colsample_bytree': 0.5941714736631407}. Best is trial 43 with value: 37.587821294369235.
[I 2026-03-22 11:17:07,329] Trial 56 finished with value: 37.530499990501745 and parameters: {'n_estimators': 64, 'max_depth': 4, 'learning_rate': 0.015108514207330186, 'subsample': 0.8916858845637312, 'colsample_bytree': 0.5999764268997306}. Best is trial 56 with value: 37.530499990501745.
[I 2026-03-22 11:17:07,402] Trial 57 finished with value: 37.53628469355353 and parameters: {'n_estimators': 64, 'max_depth': 4, 'learning_rate': 0.033377828261563144, 'subsample': 0.8934679897855065, 'colsample_bytree': 0.5920915621045029}. Best is trial 56 with value: 37.530499990501745.
[I 2026-03-22 11:17:07,499] Trial 58 finished with value: 37.5324781002203 and parameters: {'n_estimators': 64, 'max_depth': 4, 'learning_rate': 0.027613902923541607, 'subsample': 0.8924983277264147, 'colsample_bytree': 0.5844351403365655}. Best is trial 56 with value: 37.530499990501745.
[I 2026-03-22 11:17:07,576] Trial 59 finished with value: 37.65298430740827 and parameters: {'n_estimators': 64, 'max_depth': 3, 'learning_rate': 0.10287482342278033, 'subsample': 0.8980994610262946, 'colsample_bytree': 0.5716010591904386}. Best is trial 56 with value: 37.530499990501745.
[I 2026-03-22 11:17:07,671] Trial 60 finished with value: 37.69625214687369 and parameters: {'n_estimators': 64, 'max_depth': 5, 'learning_rate': 0.03174980111954233, 'subsample': 0.8924638779339727, 'colsample_bytree': 0.6104179599288566}. Best is trial 56 with value: 37.530499990501745.
[I 2026-03-22 11:17:07,766] Trial 61 finished with value: 37.55994789736167 and parameters: {'n_estimators': 64, 'max_depth': 4, 'learning_rate': 0.02394422700654, 'subsample': 0.8569429964515647, 'colsample_bytree': 0.5890472584820843}. Best is trial 56 with value: 37.530499990501745.
[I 2026-03-22 11:17:07,848] Trial 62 finished with value: 37.54308727741194 and parameters: {'n_estimators': 64, 'max_depth': 4, 'learning_rate': 0.024350963460409866, 'subsample': 0.8651821024430167, 'colsample_bytree': 0.5824838881813603}. Best is trial 56 with value: 37.530499990501745.
[I 2026-03-22 11:17:07,952] Trial 63 finished with value: 37.5571028955001 and parameters: {'n_estimators': 64, 'max_depth': 4, 'learning_rate': 0.025848295941396624, 'subsample': 0.8608494577137449, 'colsample_bytree': 0.587557289504518}. Best is trial 56 with value: 37.530499990501745.
[I 2026-03-22 11:17:08,042] Trial 64 finished with value: 37.550631495310526 and parameters: {'n_estimators': 64, 'max_depth': 4, 'learning_rate': 0.02416193218839395, 'subsample': 0.858120973097881, 'colsample_bytree': 0.5205278661715103}. Best is trial 56 with value: 37.530499990501745.
[I 2026-03-22 11:17:08,124] Trial 65 finished with value: 37.561535890392626 and parameters: {'n_estimators': 64, 'max_depth': 4, 'learning_rate': 0.025341733996551735, 'subsample': 0.8581981737268785, 'colsample_bytree': 0.5219692743697958}. Best is trial 56 with value: 37.530499990501745.
[I 2026-03-22 11:17:08,206] Trial 66 finished with value: 37.576352570788885 and parameters: {'n_estimators': 64, 'max_depth': 4, 'learning_rate': 0.04255914551630216, 'subsample': 0.8663481132521887, 'colsample_bytree': 0.5585614973816009}. Best is trial 56 with value: 37.530499990501745.
[I 2026-03-22 11:17:08,282] Trial 67 finished with value: 37.54244775592939 and parameters: {'n_estimators': 64, 'max_depth': 3, 'learning_rate': 0.03771274483011801, 'subsample': 0.8479134501323546, 'colsample_bytree': 0.5880583205476485}. Best is trial 56 with value: 37.530499990501745.
[I 2026-03-22 11:17:08,365] Trial 68 finished with value: 37.641199957632175 and parameters: {'n_estimators': 64, 'max_depth': 3, 'learning_rate': 0.08632214943497916, 'subsample': 0.8462676265298391, 'colsample_bytree': 0.5745124582250707}. Best is trial 56 with value: 37.530499990501745.
[I 2026-03-22 11:17:08,449] Trial 69 finished with value: 37.60505691136649 and parameters: {'n_estimators': 64, 'max_depth': 2, 'learning_rate': 0.04189544943570325, 'subsample': 0.8720261420861535, 'colsample_bytree': 0.5253065530118215}. Best is trial 56 with value: 37.530499990501745.
[I 2026-03-22 11:17:08,546] Trial 70 finished with value: 37.929154372546904 and parameters: {'n_estimators': 64, 'max_depth': 6, 'learning_rate': 0.05361062558816311, 'subsample': 0.9057684658312435, 'colsample_bytree': 0.6095732462285274}. Best is trial 56 with value: 37.530499990501745.
[I 2026-03-22 11:17:08,621] Trial 71 finished with value: 37.555855108910876 and parameters: {'n_estimators': 64, 'max_depth': 3, 'learning_rate': 0.023188231805130265, 'subsample': 0.8506444457009018, 'colsample_bytree': 0.5825865803118978}. Best is trial 56 with value: 37.530499990501745.
[I 2026-03-22 11:17:08,707] Trial 72 finished with value: 37.57088991164061 and parameters: {'n_estimators': 64, 'max_depth': 3, 'learning_rate': 0.03406167599227752, 'subsample': 0.8016450354828668, 'colsample_bytree': 0.6243411517768328}. Best is trial 56 with value: 37.530499990501745.
[I 2026-03-22 11:17:08,788] Trial 73 finished with value: 37.55324118302551 and parameters: {'n_estimators': 64, 'max_depth': 3, 'learning_rate': 0.020750768789856548, 'subsample': 0.8420762212752463, 'colsample_bytree': 0.5521437671784388}. Best is trial 56 with value: 37.530499990501745.
[I 2026-03-22 11:17:08,874] Trial 74 finished with value: 37.55384962478658 and parameters: {'n_estimators': 64, 'max_depth': 3, 'learning_rate': 0.016142263425976883, 'subsample': 0.843994831636604, 'colsample_bytree': 0.5584887103615538}. Best is trial 56 with value: 37.530499990501745.
[I 2026-03-22 11:17:08,955] Trial 75 finished with value: 37.63253868539057 and parameters: {'n_estimators': 64, 'max_depth': 2, 'learning_rate': 0.01672153522767639, 'subsample': 0.7765139453916678, 'colsample_bytree': 0.5501614854327876}. Best is trial 56 with value: 37.530499990501745.
[I 2026-03-22 11:17:09,040] Trial 76 finished with value: 37.574160997496655 and parameters: {'n_estimators': 64, 'max_depth': 3, 'learning_rate': 0.019822542198472085, 'subsample': 0.8095667439893452, 'colsample_bytree': 0.5166385962396274}. Best is trial 56 with value: 37.530499990501745.
[I 2026-03-22 11:17:09,118] Trial 77 finished with value: 37.589463681095246 and parameters: {'n_estimators': 64, 'max_depth': 3, 'learning_rate': 0.07137283874747372, 'subsample': 0.8397956089972886, 'colsample_bytree': 0.5578431540147821}. Best is trial 56 with value: 37.530499990501745.
[I 2026-03-22 11:17:09,199] Trial 78 finished with value: 37.6127199378604 and parameters: {'n_estimators': 64, 'max_depth': 2, 'learning_rate': 0.016037964939305104, 'subsample': 0.8908260087594285, 'colsample_bytree': 0.6042960193892}. Best is trial 56 with value: 37.530499990501745.
[I 2026-03-22 11:17:09,289] Trial 79 finished with value: 37.89752745398501 and parameters: {'n_estimators': 64, 'max_depth': 3, 'learning_rate': 0.1742455049156003, 'subsample': 0.9489155219763479, 'colsample_bytree': 0.5351327937538787}. Best is trial 56 with value: 37.530499990501745.
[I 2026-03-22 11:17:09,360] Trial 80 finished with value: 37.669830925189515 and parameters: {'n_estimators': 16, 'max_depth': 3, 'learning_rate': 0.033803586015274854, 'subsample': 0.5955873967350738, 'colsample_bytree': 0.5658417419066348}. Best is trial 56 with value: 37.530499990501745.
[I 2026-03-22 11:17:09,441] Trial 81 finished with value: 37.549088635016076 and parameters: {'n_estimators': 64, 'max_depth': 3, 'learning_rate': 0.021269455923987945, 'subsample': 0.8505572252260225, 'colsample_bytree': 0.5782793238717646}. Best is trial 56 with value: 37.530499990501745.
[I 2026-03-22 11:17:09,527] Trial 82 finished with value: 37.58646831149803 and parameters: {'n_estimators': 64, 'max_depth': 3, 'learning_rate': 0.030630313244141654, 'subsample': 0.8173779311186999, 'colsample_bytree': 0.5424762105550724}. Best is trial 56 with value: 37.530499990501745.
